text,date,likes,comments,url
"Followers on LinkedIn, I need to say a few words.I would like to make a sincere apology for my previous post, advertising an event I am hosting and claiming that I will ""literally die"" if it doesn't sell out.The truth is: that was a lie.This was a heat of the moment lapse of judgement and I am sorry to those hurt by this.Lying to people in order to make a quick profit is something that goes against my values and something a CEO would never do.I did what I did for one simple reason alone.My family has been kidnapped by terrorists and they told me I had to make that post.It felt horrible though. It was not me.In the coming months, I am going to seek therapy and practice a lot of self reflection.After that, I will be absolved of all sins that ""pre-therapy Ken"" did because it was a completely different person.Until then, I'll be taking time away from LinkedIn to spend time trying to find my family.",Ken Cheng,0,0,https://www.linkedin.com/in/ken-cheng-991849b6?miniProfileUrn=urn%3Ali%3Afsd_profile%3AACoAABivhj0By6q1ONB6QeqR4XBHHsD0L3A9vLc
"The best asset a successful man can have?A woman.But not just any woman.The one who has immense intelligence.Boundless wisdom.And endless great ideas.Ideas you can steal.Ideas you can pass off as your own at work.Ideas that make people ask ""how did you think of that?"" and you shrug and say ""I guess I'm just an outside the box thinker.""She's happy taking no credit.She's completely fine living in your shadow.Giving calm, quiet support.No drama.You can mine her ideas forever, like a golden goose.A man who has this has the one thing we all dream of:Free management consultancy at home.Give a man that and...He will give you an OK life.",Ken Cheng,0,0,https://www.linkedin.com/in/ken-cheng-991849b6?miniProfileUrn=urn%3Ali%3Afsd_profile%3AACoAABivhj0By6q1ONB6QeqR4XBHHsD0L3A9vLc
"My 9 year old son is getting bullied at school.Most parents would step in and get involved themselves. Not me.I referred him to an LLM.He used AI to come up with witty comebacks to deploy against his bullies, that were a mix of Voltaire quotes and rhyming disses.They worked. The whole school were so impressed by his oratory skills he became popular overnight.This became an issue. He started refusing to do his homework. When I asked him to do chores he would hit me with another French Philosopher.Daniel started to think of himself a God. He had to be stopped.Did I turn to ChatGPT? No, I could see the dangers of AI.I paid a child £5 to pants him. He was humiliated in front of the entire school and balance was restored.AI may have become very powerful but it will never replace the traditional methods.",Ken Cheng,0,0,https://www.linkedin.com/in/ken-cheng-991849b6?miniProfileUrn=urn%3Ali%3Afsd_profile%3AACoAABivhj0By6q1ONB6QeqR4XBHHsD0L3A9vLc
"I can understand this man's anger.For those who haven't seen Montoya yet, it's a must watch.I relate.Not because I would get mad watching my wife with another man.That didn't bother me at all.At first, I couldn't get what the problem was.But then, I had a similar experience.I saw my ex-employee Wes having lunch with his new boss.They were discussing deadlines, KPIs and also sharing inside jokes.Seeing Wes laugh made me feel like Montoya watching his woman get railed.I was overcome with rage. I felt like ripping up my own £6,000 suit, running across the restaurant screaming and tackling the boss.So I did.I'm not proud of it. But I don't regret it either.I'm passionate about my employees. Is acting on that and assaulting a stranger a crime?",Ken Cheng,0,0,https://www.linkedin.com/in/ken-cheng-991849b6?miniProfileUrn=urn%3Ali%3Afsd_profile%3AACoAABivhj0By6q1ONB6QeqR4XBHHsD0L3A9vLc
"⚠️ Here are things I've had to do as a boss for my employees that don't appear in any job description🔷 Pick up an employee's child from school because they were working late🔷 Let an employee stay in my guest house because they were going though a divorce🔷 Host an impromptu birthday party with 4 hours notice🔷 Receive a panicked phone call from same employee at 2am that night🔷 Help formulate a plan as they think they hit a deer🔷 Get up and drive 15 miles to where they are🔷 Arrive to find them sobbing🔷 Find out it wasn't a deer, it was a human🔷 Calm them down by saying it probably was a hitchhiker with no family🔷 Haul the body into my trunk🔷 Drive out to a river to dump it in🔷 It won't sink🔷 Get some petrol and a match to burn it🔷 Next morning get into work, turn on the news and see a missing person report for the CTO of our biggest rival🔷 It's the guy🔷 Our stock price jumps up🔷 Win-win🔷 Agree to never tell a soulBeing a boss isn't just emails and deadlines. It's real everyday human moments that we all experience. It's truly living.",Ken Cheng,0,0,https://www.linkedin.com/in/ken-cheng-991849b6?miniProfileUrn=urn%3Ali%3Afsd_profile%3AACoAABivhj0By6q1ONB6QeqR4XBHHsD0L3A9vLc
"Since becoming a millionaire I struggle to connect with my poor friends.Why? I haven't changed.Why do they treat me differently?Because I have a fast car?Because my watch costs more than their yearly rent?Or is it because I like to dangle a £50 note above them and make them bark like a dog?I'm still the same human being.I still breathe the same air.I just like to tell them to go ""woof woof"" and beg in a little doggy voice.I don't understand.I think it's jealousy.Or a lack of empathy.If they were in my shoes they'd also make their friends roll over and behave like an animal for money.It's unfair. I've been ostracised just for my affectionate nature.A man's best friend is his dog.A rich man's best friend is his friend Jake who he dresses in a big dog onesie and calls Rex.I miss my best friend Rex.",Ken Cheng,0,0,https://www.linkedin.com/in/ken-cheng-991849b6?miniProfileUrn=urn%3Ali%3Afsd_profile%3AACoAABivhj0By6q1ONB6QeqR4XBHHsD0L3A9vLc
"The funniest man on the internet?Ken ChengIf you haven't seen one of his ridiculous posts on Linkedin....Where have you been?On this week of the podcast we talk about all things humour and corporate nonsenseSearch ""We Have A Meeting"" where you get your podcasts",Jack Frimston,0,0,https://www.linkedin.com/in/ken-cheng-991849b6?miniProfileUrn=urn%3Ali%3Afsd_profile%3AACoAABivhj0By6q1ONB6QeqR4XBHHsD0L3A9vLc
"I was in the waiting room outside my therapist's office and I always end up sitting next to a guy who looks incredibly depressed.I know you're not supposed to talk to each other but when I see a problem, I need to fix it.""What's wrong?"" I said.""I'm at rock bottom. I keep thinking what's the point."" He replied.Hmm. ""Are you on LinkedIn? Check out this account.""I pass over my phone and it's my own account. I show him several of my own inspirational posts and his face starts to light up. First time I've seen him smile.The next week I go, he's not there. Same the week after. Two months go by and I finally see him again. He goes straight up to me and grabs me.""Hey man, I wanted to thank you. Since you showed me your posts, I've been happier and more motivated than I've ever been. I went home and cancelled therapy because with your LinkedIn, I don't need it anymore.""He gave me a big hug and said, ""you seem so well-adjusted. Why are you in therapy?""""I'm not.""I haven't been for years. But I do go to my old therapist's waiting room now and then to help those who need it.When I see a problem, I fix it.",Ken Cheng,0,0,https://www.linkedin.com/in/ken-cheng-991849b6?miniProfileUrn=urn%3Ali%3Afsd_profile%3AACoAABivhj0By6q1ONB6QeqR4XBHHsD0L3A9vLc
"Wokeness has ruined one of the oldest, most reliable business practices.It is now illegal to dress up as a ghost and haunt an abandoned amusement park to drive the price down so you can buy it.I've been doing this for decades on weekends.The Headless Horseman.Viscount Francis the Cursed Phantom.The Mutated Chicken.All concoctions of mine from the past used to deter buyers.I once hid in the walls of a top floor penthouse making goat noises for 2 months.That became my bachelor pad.But now, you're at risk of being cancelled by Gen Z mystery detectives if you do such a thing.These days you can get arrested for simply trespassing on private land and harassing potential business owners, which I was.I would have gotten away with it too had it not been for Woke Britain (and the police).",Ken Cheng,0,0,https://www.linkedin.com/in/ken-cheng-991849b6?miniProfileUrn=urn%3Ali%3Afsd_profile%3AACoAABivhj0By6q1ONB6QeqR4XBHHsD0L3A9vLc
"I often talk to homeless people and ask them ""why don't you have a job""They all answer the same way""I don't need one, I earn so much passive income from my Nvidia stock""""I'm actually a board member of Apple and my net worth is in the millions""""I just do this to feel alive again, it feeds into my humiliation kink""This is the actual truth. No one is actually homeless, they are all multimillionaires who enjoy cosplayingAnd it just goes to show, no matter how much money you earn you still get boredThat's why our economy is brokenSociety has forgotten about the top 1% and now they're forced onto the streetsIt's all well and good rewarding our heroic shareholders with money but society needs to do more to keep them entertainedWe need more hobbies for rich people",Ken Cheng,0,0,https://www.linkedin.com/in/ken-cheng-991849b6?miniProfileUrn=urn%3Ali%3Afsd_profile%3AACoAABivhj0By6q1ONB6QeqR4XBHHsD0L3A9vLc
"8 years ago we were in a MISERABLE marriage.Our house wasn't a HOME,It was a WARZONE.Here's how we fixed it:1) I accidentally shrunk our two children with the shrinking machine I inventedSuddenly, everything was so quiet again. It was PARADISE.Every day = no CHORESEvery evening = date night, no KIDSEvery night = raucous sex, on every SURFACEThe responsibility of supporting and nurturing our young children was really killing my vibe.It took us 72 hours to realise they were missing.Eventually we found them and we unshrunk them. Phew.But really, the real thing that got unshrunk that week was our brains. We learned so much from their absence.2) We shipped our children off to boarding school",Ken Cheng,0,0,https://www.linkedin.com/in/ken-cheng-991849b6?miniProfileUrn=urn%3Ali%3Afsd_profile%3AACoAABivhj0By6q1ONB6QeqR4XBHHsD0L3A9vLc
"When people talk about loneliness, homelessness and mental illness, all I see are dollar signs.Why?Because I have a rare condition where I can't tell the difference between the letter 's' and '$'.My brain reads them the sameloneliness / loneline$$assassin / a$$a$$inpo$$e$$ionle$$ne$$e$ / po$$e$$ionle$$ne$$e$They look the exact $ame to me.I'm being bombarded every day with the notion of profit.I think this is why I've had so much $ucce$$.When you always see money in front of you, it's hard not to reach out and grab it.It's a ble$$ing not a cur$€.",Ken Cheng,0,0,https://www.linkedin.com/in/ken-cheng-991849b6?miniProfileUrn=urn%3Ali%3Afsd_profile%3AACoAABivhj0By6q1ONB6QeqR4XBHHsD0L3A9vLc
"I went on a date last night with an elite-level female.She had 10/10 attractiveness, 9/10 intelligence, and a great sense of humour (laughed at all my jokes).What was the problem?She didn't have an MBA.Frankly, her lack of business expertise gave me the ick.We went to a Italian restaurant where I couldn't help notice the poor business practices in play.Missed opportunities, shoddy use of the space, very little done to minimise costs.Contrast to: when I'm out with my best friends - 5 MBAs between them, and there are only 3 of them - they would have each come up with 5 ways this restaurant could improve on the spot.She said nothing.Now, I chose this restaurant as a test to see how she'd react. She failed.I don't care how many astrophysics PhDs you have (in her case, one), true intelligence comes from one thing: having an MBA.",Ken Cheng,0,0,https://www.linkedin.com/in/ken-cheng-991849b6?miniProfileUrn=urn%3Ali%3Afsd_profile%3AACoAABivhj0By6q1ONB6QeqR4XBHHsD0L3A9vLc
"My daughter walked away from a car crash last weekLuckily she was unscathedIt was on a busy intersection in the middle of townEveryone was watchingWhich is why I plastered her car with adverts for my companyCompletely covered in website details and qr codesBystanders were worried for her life but also intrigued about cheaper backend web developmentYou know they say ""it was like a car crash I couldn't look away""Advertisers would kill for that level of engagement retentionMy daughter gets in a lot of car crashesIt wasn't luckShe's a professional stunt driver 💪",Ken Cheng,0,0,https://www.linkedin.com/in/ken-cheng-991849b6?miniProfileUrn=urn%3Ali%3Afsd_profile%3AACoAABivhj0By6q1ONB6QeqR4XBHHsD0L3A9vLc
"What if you could undergo a procedure where your non-work memories are separated from your work memories?Perfect. I'd do it in a heartbeat.I absolutely hate not being at work.Nothing worse than leaving the office to go back to the gruelling unchallenging home I share with my family.I wish I could be transported back to the office and it's 8am the next day. That's where my real family are.What is there to do at home? Eat? Watch TV? Have sex?I often do all three at work anyway.The only thing that would stop me is knowing I'd be resigning my outside self to a life of never answering another email, filling in another spreadsheet or making a PowerPoint deck ever again.Pure torture.I call this procedure ""Partition."" I hope somebody invents it soon.",Ken Cheng,0,0,https://www.linkedin.com/in/ken-cheng-991849b6?miniProfileUrn=urn%3Ali%3Afsd_profile%3AACoAABivhj0By6q1ONB6QeqR4XBHHsD0L3A9vLc
"My 7 year old son noticed at his school that one of the climbing frames kept giving the children splinters.He told the school about it. They refused to do anything.He kept telling them to fix it every day. They still refused.He started writing letters and emails every hour he was at home. They ignored them.He started a petition, and went round to every student to get them to sign it, then went to their parents' houses and got their parents to sign it. Still nothing.He had lost all hope. He almost gave up.Then, he had an idea: he set up his own stall by the climbing frame.He charged to remove splinters, treat splinter wounds and sold everyone cheap splinter insurance.The school never did anything, but at least my son made a killing.Activism doesn't work. Profiteering does.",Ken Cheng,0,0,https://www.linkedin.com/in/ken-cheng-991849b6?miniProfileUrn=urn%3Ali%3Afsd_profile%3AACoAABivhj0By6q1ONB6QeqR4XBHHsD0L3A9vLc
"Word of my business leadership skills have circulated and I've been invited to a panel talk.I was told The ""C"" Word was CEO but the talk is actually about being Chinese in Britain.Luckily I am also an expert on that according to Malcolm Gladwell's 10,000 hour rule.This Friday.British Library.",Ken Cheng,0,0,https://www.linkedin.com/in/ken-cheng-991849b6?miniProfileUrn=urn%3Ali%3Afsd_profile%3AACoAABivhj0By6q1ONB6QeqR4XBHHsD0L3A9vLc
"I stopped washing my hands. Why? Because it doesn't make me any money.Has it negatively affected any major business deals?Have my profits gone down?Has even a single person commented?The answers to those are ""no"", ""no"" and ""all the time"", respectively.But it's only the first two that matter.Whenever you take any action, the only thing I ask is, ""does this add to my bottom line?""If the answer is no, I stop doing it.Simple.I haven't washed my hands since 2017, saving a valuable 3 seconds that I was wasting every bathroom trip.While you're out there worrying about so-called ""clean hands"", I'm choosing profit.I'm min-maxing weeing.",Ken Cheng,0,0,https://www.linkedin.com/in/ken-cheng-991849b6?miniProfileUrn=urn%3Ali%3Afsd_profile%3AACoAABivhj0By6q1ONB6QeqR4XBHHsD0L3A9vLc
"I know someone who is currently in his 12th round of interviews for a consultant position.Drew has been called back for interview after interview, each one asking him to generate new ideas to improve the company's business.He should pull out, but he desperately wants this job.How do I know him?I'm the one interviewing him.Drew is actually 1 of 15, all being considered for the same role.Except, the role will never be filled.It doesn't need to. The several applicants are between them doing the job for free.All they have is the vague promise of something real.I've called it the ""work situationship"".And it's revolutionised employment.A shame that they have so little self respect and don't quit.I have no choice but to exploit them.",Ken Cheng,0,0,https://www.linkedin.com/in/ken-cheng-991849b6?miniProfileUrn=urn%3Ali%3Afsd_profile%3AACoAABivhj0By6q1ONB6QeqR4XBHHsD0L3A9vLc
"Time for a history lesson. I actually invented the term ""competitive salary"".Before, job offers would tell you the actual salary. Yuck.No, it's much better the applicant is kept in the dark for as long as possible.Would you tell someone everything you can offer on the first date? No, there is something called ""mystique"".The mystique of not knowing the pay makes a job much sexier.A bunch of recruiters and CEOs got in a room and had a massive brainstorming session. It lasted 72 hours.We threw a bunch of ideas around.""Good salary"" was too limp and vague.""High salary"" was promising too much.""Sexy salary"" was great alliteration, but did we really want people thinking they could have sex with their salary?That's when I had it...""competitive salary.""We could picture it now. Applicants reading it and thinking ""wow, this salary is COMPETITIVE. It's the Michael Phelps of salaries. My salary could beat up your salary.""It was perfect. It said so much while not committing to anything at all.When those golden words left my mouth, everyone in that room knew I had changed recruiting forever.I received a 3 minute standing ovation and I did six laps of high fives, then crowdsurfed out of there.",Ken Cheng,0,0,https://www.linkedin.com/in/ken-cheng-991849b6?miniProfileUrn=urn%3Ali%3Afsd_profile%3AACoAABivhj0By6q1ONB6QeqR4XBHHsD0L3A9vLc
"Rejection is painful.For the person doing the rejection as well as the person being rejected.It hurts me so much to tell someone I'm crushing their dreams.I feel like George in Of Mice and Men, taking Lennie out and shooting him in the back of the head.I feel like I'm taking a life.That's why as an employer I never send out a rejection email.No matter how many interviews they have, they will never see a formal rejection out of me.It's too painful.People call this ""ghosting"". I call it ""giving hope"".There is no better feeling than waiting to hear back from a job interview. That hopeful feeling of endless potential.I let people live with that hope forever.I'm never pulling that trigger, Lennie.",Ken Cheng,0,0,https://www.linkedin.com/in/ken-cheng-991849b6?miniProfileUrn=urn%3Ali%3Afsd_profile%3AACoAABivhj0By6q1ONB6QeqR4XBHHsD0L3A9vLc
"£10,000 or my book?I asked a random woman on the street which she would rather take.I fully expected her to say the money instead of a book that'll be available in regular stores for £15.She did say the £10,000.A huge mistake. Why?Inside my book I had hidden £50,000 in cash.By being greedy, this woman made a net loss of £40,000.The lesson?When someone offers you money or their book, always take the book in case it has £50,000 hidden inside it.",Ken Cheng,0,0,https://www.linkedin.com/in/ken-cheng-991849b6?miniProfileUrn=urn%3Ali%3Afsd_profile%3AACoAABivhj0By6q1ONB6QeqR4XBHHsD0L3A9vLc
"This may come as a shock, but even I suffer from Imposter Syndrome at work.Every day I think I don't deserve to be here, and I've taken someone else's place. I feel like a total imposter.Because I am.One day, I met a man on a secluded beach. He asked me to look after his clothes and bag while he went for a swim.The tides were particularly violent that day. I watched him get swept up by the ocean; I knew he wasn't coming back.I check his bag. In it was his passport, his birth certificate, £100k in cash and a 50-page document titled ""How To Impersonate Me If I Die At Sea"".His name was Ken Cheng.I stole the real Ken Cheng's identity. I stole his assets. I stole his life.I am an imposter. And boy it feels good.",Ken Cheng,0,0,https://www.linkedin.com/in/ken-cheng-991849b6?miniProfileUrn=urn%3Ali%3Afsd_profile%3AACoAABivhj0By6q1ONB6QeqR4XBHHsD0L3A9vLc
"Today, I did the unthinkable. I deleted one of my LinkedIn posts.To my loyal followers, from the bottom of my heart, I am sorry.It just wasn't good enough.""Why does that matter? They're just posts,"" an idiot might say.People are relying on my posts for business advice. When they aren't good, people die.I'm like a brain surgeon, but of the mind.Except a brain surgeon is only responsible for one life at a time. I'm responsible for 108,000.My Grandfather was one of the first soldiers on the beaches of Normandy. He said to me, ""I don't know how you have the bravery to post on LinkedIn.""He's right. Every time I post I feel like I'm at the front of the boat, machine gun in hand, ready to take the beach. It takes a lot of bravery.And I failed last time. I let down my country. But I won't give up.Next time, I will take the beach.",Ken Cheng,0,0,https://www.linkedin.com/in/ken-cheng-991849b6?miniProfileUrn=urn%3Ali%3Afsd_profile%3AACoAABivhj0By6q1ONB6QeqR4XBHHsD0L3A9vLc
"I don’t care if you choose to work from home or not.I don't care if you come in 3 hours late and smell of tequila.I don't care if you play Minesweeper while we're on a Teams call.I don't care if you watch cartoon animal porn in the office during work hours.Life happens! I hired you for a job and I only care about one thing:I'm allowed to completely exploit you and disregard your employment rights at any time.If you are willing to be treated like a soulless profit delivering machine, you can do whatever you want.You don’t need to justify a day off, as long as you make up for it by working 24 hours without overtime pay.You don’t need to explain how traffic was bad, as long as you drive me to the airport later.You don't need to apologise for having a personal life, as long as you invite me along and introduce me to your hot single friends.Yes, I care about results but I also care about exerting my power and dominance to make myself feel big. That's why I became a CEO.My advice for anyone hiring:1. Select people who are too naïve or meek to say anything while you treat them like a worm2. Make sure they own headphones (for the animal porn)3. They have hot friends4. Get out of their way.Agree?",Ken Cheng,0,0,https://www.linkedin.com/in/ken-cheng-991849b6?miniProfileUrn=urn%3Ali%3Afsd_profile%3AACoAABivhj0By6q1ONB6QeqR4XBHHsD0L3A9vLc
"Hiring isn't always morally straightforward.I found a perfect candidate but there was one catch.He had a long history of financial crime. Truly an ethical quandary.Do I protect my reputation and move on? Would that be doing this man a disservice though? Everyone deserves a fifth chance.I had a solution.In the interview, I looked him in the eye and asked him to say “I will not do crime ever again.” He did.I then provided a picture of his mother and asked him to hold it and swear on her life. He did.Phew. I believed him. But I still needed to make sure.After he left, I tailgated him for several hours. I watched him go to the shops, pick up his children, then I parked outside his home for a bit and watched him watch Netflix until he got tired and got into bed with his wife.He didn't commit a single crime once.That was good enough for me.",Ken Cheng,0,0,https://www.linkedin.com/in/ken-cheng-991849b6?miniProfileUrn=urn%3Ali%3Afsd_profile%3AACoAABivhj0By6q1ONB6QeqR4XBHHsD0L3A9vLc
"One of my employees, Sean, was on a first date and it wasn't going so well.He went to the bathroom and texted me for advice.Most bosses would say this is a breach of boundaries, but I stopped reading to my son to call Sean immediately.He wanted to give up and go home.""No Sean,"" I said. ""There is no deal that's impossible to close. Just be honest with her.""He got back to the table and told her he was nervous so he called his boss (me).""Who's your boss?""""His name is Ken Cheng.""""You work for Ken Cheng?!"" Her body language changed immediately.They talked for hours about their favourite posts of mine and, afterwards, she invited him back to hers.Become such a great boss that even the mere mention of working for you gets your employees laid.",Ken Cheng,0,0,https://www.linkedin.com/in/ken-cheng-991849b6?miniProfileUrn=urn%3Ali%3Afsd_profile%3AACoAABivhj0By6q1ONB6QeqR4XBHHsD0L3A9vLc
"The gym isn't just a place for physical self-improvement, but mental too.I go to the same gym as Diary of a CEO's Steven Bartlett. I've gained so much from just being in the same changing room.I've never actually spoken to him, but there are other ways to get to know someone.Here's what I've learned about business by smelling his used towel.1. Even his sweat smells successful. I've changed my diet 50 times to try and find this perfect rich man odour.2. He never uses a towel twice. I had to dig the towel out of a bin. He is so rich every good is a perishable good.3. He spells out dollar signs with the way he dries himself, or the symbol of a currency that's doing well in ForEx currently. Manifest even when wet.Soon, I'll know him well enough to make the first move (steal his phone while he's in the shower to take 33 selfies of me holding my business card)",Ken Cheng,0,0,https://www.linkedin.com/in/ken-cheng-991849b6?miniProfileUrn=urn%3Ali%3Afsd_profile%3AACoAABivhj0By6q1ONB6QeqR4XBHHsD0L3A9vLc
