text,date,likes,comments,url
"I met the Queen just before she died. She said I deserved a Knighthood for my services to the British Empire and she would make that happen right away.Unfortunately she passed not long after and I've finally come to accept that it probably  isn't going to happen.I guess the paperwork never went through, or she lied to my face.Now, any time an employee comes to me saying they ""were promised a pay rise"", I just say ""well I was promised a Knighthood.""The lesson is: never meet your heroes. And if you do, get everything they say in writing.",Ken Cheng,0,0,https://www.linkedin.com/in/ken-cheng-991849b6?miniProfileUrn=urn%3Ali%3Afsd_profile%3AACoAABivhj0By6q1ONB6QeqR4XBHHsD0L3A9vLc
"I have been looking for a job for 500 days now.The last rejection I got gave me this feedback:""You're an exceptional candidate, too exceptional. Being in an office with someone as intelligent and talented would make me feel like a small man. You are also incredibly handsome and I'm worried you would get more attention than me, and my wife would see you and leave me for you. You're also taller than me.""Sigh. Another one of these. Back to the drawing board.",Ken Cheng,0,0,https://www.linkedin.com/in/ken-cheng-991849b6?miniProfileUrn=urn%3Ali%3Afsd_profile%3AACoAABivhj0By6q1ONB6QeqR4XBHHsD0L3A9vLc
"Last week I was in a fish & chip shop and the man serving me was a millionaire.Yes that's right.He was an orthopedic surgeon for 30 years but now just serves fish and chips for 3 hours a night because it helps clear his mind.A fascinating way to live your life.I ordered cod and chips and thanked him for the impact he had on me.The next day I developed severe food poisoning from the fish so I anonymously called the health inspectors. They closed the place down for good.I guess that orthopedic surgeon will have plenty more time to clear his head now.Stay in your lane, doctor. Fish aren't feet.hashtag#FishArentFeet",Ken Cheng,0,0,https://www.linkedin.com/in/ken-cheng-991849b6?miniProfileUrn=urn%3Ali%3Afsd_profile%3AACoAABivhj0By6q1ONB6QeqR4XBHHsD0L3A9vLc
"Yes I am one of those mobile gaming ""whales"" you've heard about.I've spent £8,000 on an app called Monkey Farmer: Rise of Bobo.I'm level 134 with 7 billion Primate score. Maybe top 3 in the world.I spend 7 hours a day for the last 8 years keeping it up.Is it a waste of time? No.It has taught me so much about entrepreneurship. I would not be the businessman I am today without the hard work and research I put into my monkeys.It has also taught me valuable lessons, like when the game caused me to miss the birth of my third child, I learned the importance of not missing the birth of your child.I would have not known that.So yes, I may be a ""whale"", but whales are also kings of the ocean, and in this case, the Monkey Farming industry. Consider that.",Ken Cheng,0,0,https://www.linkedin.com/in/ken-cheng-991849b6?miniProfileUrn=urn%3Ali%3Afsd_profile%3AACoAABivhj0By6q1ONB6QeqR4XBHHsD0L3A9vLc
1989: Was born in the UK. Couldn't speak English. Was a baby1990: Still a baby. No business degree at all2024: Became CEO of a successful companyWow! What an amazing journey. Thank God I started with nothing - it just pushed me to do more.,Ken Cheng,0,0,https://www.linkedin.com/in/ken-cheng-991849b6?miniProfileUrn=urn%3Ali%3Afsd_profile%3AACoAABivhj0By6q1ONB6QeqR4XBHHsD0L3A9vLc
"For the last few years I have only asked one question during the hiring process. It's a simple one:""Do you like anime?""Anime can teach us a lot about business.One Piece is all about finding that USP so your business model stands out.Naruto is all about building your brand by enhancing a Ninja portfolio.Attack on Titan is a good lesson in protecting your assets with strong cybersecurity.There is not a single anime I've seen that hasn't made me a better CEO.Anyone who says they don't watch anime will never succeed in business and will be homeless in 5 years.Who agrees?",Ken Cheng,0,0,https://www.linkedin.com/in/ken-cheng-991849b6?miniProfileUrn=urn%3Ali%3Afsd_profile%3AACoAABivhj0By6q1ONB6QeqR4XBHHsD0L3A9vLc
"A lot of people yelled at me for firing one of my employees whose wife just had a baby.But the very next day, out of desperation, he went and bought £500 worth of lottery tickets.Guess what happened.He won nothing.However, on the way home from the shops a famous singer hit him with her car.He ended up in hospital with 8 broken bones and the singer paid him £2.5 million to keep things quiet.Had I not fired him, none of this would've ever happened. Now he is rich and has more time to spend with his child.I'm still waiting for my cut of the winnings.",Ken Cheng,0,0,https://www.linkedin.com/in/ken-cheng-991849b6?miniProfileUrn=urn%3Ali%3Afsd_profile%3AACoAABivhj0By6q1ONB6QeqR4XBHHsD0L3A9vLc
"You're not allowed to raise your voice anymore in 2024.Unless of course, you exclusively hire employees who have a fetish for being yelled at.That's why I expect all employees to list their fetishes on their CV.If they haven't, it's tricky, because you're not allowed to straight up ask people their fetishes in a job interview in 2024.Unless, of course, you exclusively hire people who have a fetish for oversharing.Which again would be solved by my point above.Put your fetishes on your CV if you want to stand out above the rest.",Ken Cheng,0,0,https://www.linkedin.com/in/ken-cheng-991849b6?miniProfileUrn=urn%3Ali%3Afsd_profile%3AACoAABivhj0By6q1ONB6QeqR4XBHHsD0L3A9vLc
"SEO is very important in all aspects of naming, including naming your own child. Just ask my newborn son, ""75% Off Taylor Swift Tickets Who Is The New James Bond Cheng"".",Ken Cheng,0,0,https://www.linkedin.com/in/ken-cheng-991849b6?miniProfileUrn=urn%3Ali%3Afsd_profile%3AACoAABivhj0By6q1ONB6QeqR4XBHHsD0L3A9vLc
"Last night's England game is exactly like how my first business started.It was extremely unprofitable for 99% of it's beginning period (much like in the match). I was making so many mistakes and we were hemorrhaging money (instead of goals).However, it doesn't matter how badly you perform for the duration as long as you can pull it back at the end, in the 90th minute.That's exactly how I did it, with a Bellingham style overhead kick that saved the business.(My father injected £5 million cash into the business)You are never truly out of the Euros as long as you have excellent skill.",Ken Cheng,0,0,https://www.linkedin.com/in/ken-cheng-991849b6?miniProfileUrn=urn%3Ali%3Afsd_profile%3AACoAABivhj0By6q1ONB6QeqR4XBHHsD0L3A9vLc
"I found out one of my employees, Dave, has the Super Duolingo Family Plan (a Premium Subscription service you can add other people to) and has a couple free slots to share on it.Immediately I held a meeting. I opened by saying how important it is that this office feels like a family. Dave seemed uninterested. He did not get the hint.The next day I held another meeting, this time focussing on how important it is to *understand each other*, despite any communication barriers. Nothing.The third day I called him in for a meeting and asked him, ""if you were to name one father figure in your life, who would it be?"" He said his actual father. He really wasn't picking up what I was putting down.I finally got sick of it and blurted out: ""Add me to your Duolingo family plan or you're working this Saturday.""He was flummoxed - this was a complete surprise to him despite my many hints.He obliged, although he felt uneasy. Often, difficult conversations like this aren't easy. But still, mission accomplished.Direct communication is very important in the workplace.",Ken Cheng,0,0,https://www.linkedin.com/in/ken-cheng-991849b6?miniProfileUrn=urn%3Ali%3Afsd_profile%3AACoAABivhj0By6q1ONB6QeqR4XBHHsD0L3A9vLc
"I have been called a ""manger"" before but it fits because when I founded my company I gave birth to Jesus",Ken Cheng,0,0,https://www.linkedin.com/in/ken-cheng-991849b6?miniProfileUrn=urn%3Ali%3Afsd_profile%3AACoAABivhj0By6q1ONB6QeqR4XBHHsD0L3A9vLc
"If you interview for me, do NOT negotiate on the salary price.When candidates say ""I'm worth more than that on the market"", I'm personally insulted, because *I* am worth taking a paycut as a boss.Working for me provides more wisdom and future benefits than any money could ever get you.When you ask for more money, it's basically saying I'm a terrible boss, mentor and sensei.Working for me is worth 30% more than working for anyone else. That is why I'm happy to pay you 30% less than normal.If you won't take the 30% cut, you are basically calling me a shithead, spitting in my face, then pissing on my carpet. It's disrespectful.""I have bills to pay"". So do I. Do you want my family to go hungry? If you want a better salary, then you're basically coming to my house and ripping the food out of my children's mouths, then murdering them.Those who don't negotiate are good decent people. Those who do negotiate are akin to con artists or serial killers.",Ken Cheng,0,0,https://www.linkedin.com/in/ken-cheng-991849b6?miniProfileUrn=urn%3Ali%3Afsd_profile%3AACoAABivhj0By6q1ONB6QeqR4XBHHsD0L3A9vLc
"A knife is a very interesting invention.A knife can be used to spread butter on your toast, but it can also be used to cut your enemies.My words are the same.They can be used to butter up your potential clients, but also cut them deep if they betray you.My words are like knives.They come in many different sizes and can show two different sides of me.The difference?No one would pay hundreds of pounds for my knives, but you now can for my words.Buy my latest book in stores today and get a free M&S butter knife with each copy.(I thought of this post while spreading butter on my toast this morning.)",Ken Cheng,0,0,https://www.linkedin.com/in/ken-cheng-991849b6?miniProfileUrn=urn%3Ali%3Afsd_profile%3AACoAABivhj0By6q1ONB6QeqR4XBHHsD0L3A9vLc
"Lining up for class. Detentions. Having to ask before going to the toilet. Homework. Singing hymns in assembly.Isn't it crazy how we make kids do these things in school, yet you never have to do them as an adult? How on Earth can you justify forcing children to do these things if they are not reflected in adult working life?That's why I have started giving my employees detentions.Rick was 20 minutes late last week (missing the daily He's Got The Whole World in His Hands). This had been his third strike, so I told him he had 2 weeks ""detention"" after work. When he gave some lip back, claiming I ""can't do that"" and he's a ""grown man"", I told him he had 3 weeks.Things, however, really backfired once I consulted my lawyers and found out I was obligated to pay them overtime pay for their detentions. Soon, all the employees were breaking all sorts of rules to get (paid) detention. Maria threw ketchup into the photocopier, Brian superglued himself to his keyboard, Simon committed embezzlement (although I suspect he was doing this anyway.)And this is why overtime pay should not exist - how can I teach these brats a lesson if I also have to pay them at the same time? Teachers never have to pay their students to keep them after school.Teachers truly have it easy.",Ken Cheng,0,0,https://www.linkedin.com/in/ken-cheng-991849b6?miniProfileUrn=urn%3Ali%3Afsd_profile%3AACoAABivhj0By6q1ONB6QeqR4XBHHsD0L3A9vLc
"I removed the toilets from my office for 48 hours. What happened next will shock you...No one noticed. Not a single person. Why?It was the weekend and no one was in.What does this tell us?We don't need toilets during the weekend.In fact do we need any of it? The electricity? The office supplies? The entire building?So much is being wasted on weekends.Maybe we shouldn't have weekends at all, then none of that would be wasted.No more weekends.",Ken Cheng,0,0,https://www.linkedin.com/in/ken-cheng-991849b6?miniProfileUrn=urn%3Ali%3Afsd_profile%3AACoAABivhj0By6q1ONB6QeqR4XBHHsD0L3A9vLc
"At my company we committed to an allergy free office. When people said they were allergic to nuts, I made sure to remove all nuts.However, one employer, Colin, started coughing loudly during the meeting and then said ""sorry I'm allergic to bullshit.""I wasn't sure how to deal with this one, but because of today's attitudes, it's important everyone's needs are met and I had to try to accommodate him. Plus he was the nephew of a major shareholder.He said he wanted the company to hire a 24/7 ""Bullshit Detector"". I was iffy but he threatened a discrimination lawsuit, so I obliged.It turned out that Bullshit Detector was just him pretending to be a radar, going around screaming ""BEEP.....BEEP...."" until he saw his office nemesis, Bridget, at which point he'd beep faster.This was outrageous. I now had to pay him two salaries, one for his normal job and one for his job as a BS detector.I never thought I'd say this but things gone too far, and it was better in the 2010s when we didn't try to accommodate everyone. My hands are tied now and the Colins are free to roam the earth abusing the system.",Brain Expansion Group,0,0,https://www.linkedin.com/groups/13927028?q=highlightedFeedForGroups&highlightedUpdateUrn=urn%3Ali%3AgroupPost%3A13927028-7210549667200151552
"At my company we committed to an allergy free office. When people said they were allergic to nuts, I made sure to remove all nuts.However, one employer, Colin, started coughing loudly during the meeting and then said ""sorry I'm allergic to bullshit.""I wasn't sure how to deal with this one, but because of today's attitudes, it's important everyone's needs are met and I had to try to accommodate him. Plus he was the nephew of a major shareholder.He said he wanted the company to hire a 24/7 ""Bullshit Detector"". I was iffy but he threatened a discrimination lawsuit, so I obliged.It turned out that Bullshit Detector was just him pretending to be a radar, going around screaming ""BEEP.....BEEP...."" until he saw his office nemesis, Bridget, at which point he'd beep faster.This was outrageous. I now had to pay him two salaries, one for his normal job and one for his job as a BS detector.I never thought I'd say this but things gone too far, and it was better in the 2010s when we didn't try to accommodate everyone. My hands are tied now and the Colins are free to roam the earth abusing the system.",Ken Cheng,0,0,https://www.linkedin.com/in/ken-cheng-991849b6?miniProfileUrn=urn%3Ali%3Afsd_profile%3AACoAABivhj0By6q1ONB6QeqR4XBHHsD0L3A9vLc
"When I was in bed with a beautiful woman last week, I actually yelled out the name of a publicly traded company instead of hers.She was taken aback, but inquisitive. ""What's S*****d?""""Oh it's a new technology startup that's going to blow up in the next few weeks. I'm sorry I am just very excited about it.""I thought I had blew it, because she went over to her phone as if she was about to leave. It turns out she immediately went to buy £5k worth of stocks in S*****d.""I know I'm hot,"" she said. ""But if you think this stock is hotter, then it must be good.""This morning, the stock price went up by 10x it's value. I had made her £45k.You never know when great business opportunities might arise. Can anyone else say that sex with them can get them a 900% return on investment?",Ken Cheng,0,0,https://www.linkedin.com/in/ken-cheng-991849b6?miniProfileUrn=urn%3Ali%3Afsd_profile%3AACoAABivhj0By6q1ONB6QeqR4XBHHsD0L3A9vLc
"I WON'T ask you to:↳ Start or finish work at a set time↳ Give a reason if you ask for time off work↳ Stay at your desk if you need to run an errand↳ Come into the office if you work better elsewhereI WILL ask you to:↳ Occasionally store a black duffle bag in your loft↳ Board a flight with a brown envelope taped to your back, now and again↳ Claim no knowledge of the man known as 'The Shadow', should anyone ask↳ Strictly answer 'No comment,' if a situation arises where that may be relevantBecause good leadership all comes down to trust.Trusting your employees to keep their mouths shut.hashtag#leaderhashtag#leadership",George Smith,0,0,https://www.linkedin.com/in/ken-cheng-991849b6?miniProfileUrn=urn%3Ali%3Afsd_profile%3AACoAABivhj0By6q1ONB6QeqR4XBHHsD0L3A9vLc
"If your house is fire, do not call the fire brigade. Call someone in recruitment, because they will be able to find you someone with fire safety training much quicker.Recruiters are the real heroes.",Ken Cheng,0,0,https://www.linkedin.com/in/ken-cheng-991849b6?miniProfileUrn=urn%3Ali%3Afsd_profile%3AACoAABivhj0By6q1ONB6QeqR4XBHHsD0L3A9vLc
"I started learning a new language on Duolingo because of our new international business partners.I'm crushing it but it's struggling to teach me anything useful in the business context.I can ask ""how much is the bus"" (which is very insulting that they'd take public transport), ""would you like milk or sugar in your tea"" (puts me in position of weakness) or ""how big is your bathroom"" (which is actually a good phrase to know).I want to create a Duolingo for business where you can learn the following phrases:""I will crush you if you double cross me""""Welch on this deal and I will put you in the ground""""Do you like the smell of raw fish?""I would make it and it would make millions, but I'm quite busy right now.",Ken Cheng,0,0,https://www.linkedin.com/in/ken-cheng-991849b6?miniProfileUrn=urn%3Ali%3Afsd_profile%3AACoAABivhj0By6q1ONB6QeqR4XBHHsD0L3A9vLc
"This week I announced to my employees that I'd be firing 10% of the staff, and I'd be deciding based on who is the worst dressed. A bold move but hear me out:The next day, everyone came in wearing their best outfits. Some even came in costume, which I encouraged. Soon, people forgot about the firings, and the morale was jubilant.We even won a costume contest that was won by Ralph in Internal Comms, dressed as a dragon from his favourite anime (yes we hire Weebs). Everyone cheered Ralph and he crowdsurfed out of the office.The lesson here is that even in tough times, humans can reach within themselves to make the most of it. Feeling sad and complaining is a skill issue.I did unfortunately fire Ralph because he was incompetent.",Ken Cheng,0,0,https://www.linkedin.com/in/ken-cheng-991849b6?miniProfileUrn=urn%3Ali%3Afsd_profile%3AACoAABivhj0By6q1ONB6QeqR4XBHHsD0L3A9vLc
"Being a Landlord is really tough. We get a lot of flak but no one realises the suffering we have to endure.For example when I emailed my tenant to say their rent was going up by 45%, they were very mean to me.This could've had a disastrous effect on my mental health.Be careful with your words, even when you're speaking with someone incredibly rich.",Ken Cheng,0,0,https://www.linkedin.com/in/ken-cheng-991849b6?miniProfileUrn=urn%3Ali%3Afsd_profile%3AACoAABivhj0By6q1ONB6QeqR4XBHHsD0L3A9vLc
"2021: no salary increase2022: no salary increase2023: no salary increase2024: no salary increaseEvery year my employees ask for a salary increase and I say no. If they have everything they want then they won't strive for better.So far I have never heard any of then complain about this to my face, so I must be doing something right.",Ken Cheng,0,0,https://www.linkedin.com/in/ken-cheng-991849b6?miniProfileUrn=urn%3Ali%3Afsd_profile%3AACoAABivhj0By6q1ONB6QeqR4XBHHsD0L3A9vLc
3 tips to improve your career:- 1: Get better at things- 2: Be less bad at things- 3: Sign up to my seminar for £499.99,Ken Cheng,0,0,https://www.linkedin.com/in/ken-cheng-991849b6?miniProfileUrn=urn%3Ali%3Afsd_profile%3AACoAABivhj0By6q1ONB6QeqR4XBHHsD0L3A9vLc
"You are never truly alone or without friends in the modern world. Here's why.One night I was feeling lonely as all my friends were busy and I wanted to hang out. So I decided to wander the streets alone.While I was out, I noticed a sign that was advertising Sky TV's True Detective. It reminded me how a friend also suggested this show. That's when it hit me.Billboards are your friends too. Think about it. What are friends for, but to suggest things for you to enrich your own life with? In fact, adverts can do that job even better because they have a graphic design budget behind them.You don't need friends anymore as long as advertising exists. Your true friends? Corporate marketing.I went home and watched True Detective on my own and it was alright.",Ken Cheng,0,0,https://www.linkedin.com/in/ken-cheng-991849b6?miniProfileUrn=urn%3Ali%3Afsd_profile%3AACoAABivhj0By6q1ONB6QeqR4XBHHsD0L3A9vLc
"You have to be prepared to make cuts.Sometimes you cannot afford to pay all your workers. Sometimes a worker is being incompetent and lousy.Last Summer, I had a team of 5 employees. Four were doing amazingly, producing great work constantly and always making the effort. The last was slacking, late for all their appointments and being generally bad vibes.News came that our budget was slashed 20%. It came to a tough decision, but I had to let the underperfoming employee leave. I told them to pack their things and go - they no longer had my support.This story is actually about my five children. The youngest, then 16, was forced to move out as they were failing their GCSEs.Interestingly, people always think the story is fine when I tell it about my employees, but not okay when it's about my children. Makes you think.",Ken Cheng,0,0,https://www.linkedin.com/in/ken-cheng-991849b6?miniProfileUrn=urn%3Ali%3Afsd_profile%3AACoAABivhj0By6q1ONB6QeqR4XBHHsD0L3A9vLc
"I'm a very big proponent of boycotts. They are incredibly important and I will lay down my life for a cause. However I also really enjoy Eurovision.That's when I came up with an ingenious idea: boycott offsetting. If I can convince two friends to boycott it, I can still watch it guilt free and still be net +1 boycott.No one would bite. I then offered to pay two strangers £200 each, but most people thought it was a scam. That's when I knew I was ahead of my time.Suddenly, a brain wave. I had access to a whole load of employees I had direct power over and could manipulate without consequence.I found out casually who would be watching the show during the week. I then invented a fake deadline that meant two of them had to work Saturday between 8pm - 12am (I convinced them it was our Sydney clients because of the timezone). I then blocked BBC iPlayer in the office so they could not catch a glimpse of it.Voila, boycott offsetting completed. I watched Eurovision guilt free, allowing me to stick true to my principles and eat them too.Another problem solved using wit, cunning and money.",Ken Cheng,0,0,https://www.linkedin.com/in/ken-cheng-991849b6?miniProfileUrn=urn%3Ali%3Afsd_profile%3AACoAABivhj0By6q1ONB6QeqR4XBHHsD0L3A9vLc
"Would the workplace be different if people had their net worth visibly tattooed on their forehead?Not mine, because my employees are forced to do that already.It's not had a positive effect on productivity whatsoever but I enjoy knowing how much money people have, so it stays.",Ken Cheng,0,0,https://www.linkedin.com/in/ken-cheng-991849b6?miniProfileUrn=urn%3Ali%3Afsd_profile%3AACoAABivhj0By6q1ONB6QeqR4XBHHsD0L3A9vLc
"If someone applies for a job I'm hiring for and I see Oxbridge on their CV, I will NOT interview them. I will even throw the CV straight into the bin, here's why:..............I hire them on the spot, no questions asked. People who went to Oxbridge are automatically better than other people.",Ken Cheng,0,0,https://www.linkedin.com/in/ken-cheng-991849b6?miniProfileUrn=urn%3Ali%3Afsd_profile%3AACoAABivhj0By6q1ONB6QeqR4XBHHsD0L3A9vLc
"Anger is a healthy and ok emotion.That's why every time anything goes wrong in my life, I go to the designated ""Anger Room"" in my office building.It's a completely safe space to scream whatever obscenities you want, destroy expensive objects and release your animal urges.I go there after any setback, like whenever my stocks dip more than 2% or I've lost a game of Super Auto Pets.Letting off steam is very important for productivity, which is why I go there, shout ""you f******* C***"" for 5 minutes straight then smash up the PC in there with a baseball bat. I do this twice an hour, which is normal and healthy.The only downside is this Anger Room is still being used as Steve's office, my head of HR. Poor guy who has to listen to these normal outbursts, and have his PC replaced every time.Anger is a normal everyday trait. In order to move past it we must understand it and deal with it in a practical and efficient way.",Ken Cheng,0,0,https://www.linkedin.com/in/ken-cheng-991849b6?miniProfileUrn=urn%3Ali%3Afsd_profile%3AACoAABivhj0By6q1ONB6QeqR4XBHHsD0L3A9vLc
"You need to find job opportunities anywhere you can.Let me tell you a story.I went into the reception of a major marketing firm to use the restroom.They were waiting for an interviewee to turn up, but that man never showed. They kept calling his name over and over.Eventually I took a chance.""Oh sorry, that's me. I misheard you the first seven times.""I went into the interview and luckily I had enough experience in interviews to be able to walk it. They offered me a job on the spot.Now came a problem. They still knew me as the other person I was expecting. So I said,""Hey can you remind me of my address again? Just checking it's up to date.""A clever on the spot move in making them think I knew my own address.I then went to that address and told him the whole situation, with an offer: I will give him 10% of my earnings, work-free, if he lets me keep doing that job under his name.That man's name: Ken Cheng. I still give him 10% of my salary, while he plays Fortnite.Oh and also, I never needed to use the restroom.hashtag#identityfraud",Ken Cheng,0,0,https://www.linkedin.com/in/ken-cheng-991849b6?miniProfileUrn=urn%3Ali%3Afsd_profile%3AACoAABivhj0By6q1ONB6QeqR4XBHHsD0L3A9vLc
