text,date,likes,comments,url
"I was in an unaired episode of Dragon's Den a couple decades ago. I managed to secure a £200,000 investment for my product, a massive win.Later, in the green room I saw one of the Dragons tip a four full boxes of Celebrations chocolates into his bag and no one did anything. It was the same Dragon that invested in my company.I decided to say something.""Excuse me, you can't take these chocolates, they're for everyone.""""I'm a fucking dragon, I can do whatever I want."" The Dragon, who shall remain nameless, got extremely irate. ""I didn't become the CEO of Bannatyne Health Club & Spa by being a coward.""We then got into a fist fight, which I won pretty easily thanks to watching Van Damme movies. However, my episode was cut from the show and the investment deal was withdrawn. I lost out on £200,000 for doing the right thing.Fast forward 20 years, I'm CEO now, sitting in a green room with four boxes of Celebrations in front of me. I now understood where that Dragon was coming from, and I tipped all four boxes worth into my bag: no one did a thing.It's very easy to judge a CEO before you've walked a mile in their shoes, but now I get it. Every single one of us would steal communal chocolates if we had the power to.That was a £200,000 lesson, but the most useful one I ever learnt. I'm no longer a coward.",Ken Cheng,0,0,https://www.linkedin.com/in/ken-cheng-991849b6?miniProfileUrn=urn%3Ali%3Afsd_profile%3AACoAABivhj0By6q1ONB6QeqR4XBHHsD0L3A9vLc
"There's nothing I hate more than when I get I'm Spartacus'd by a united office.Someone in the office screwed up royally on a major case so I gathered them in a meeting to ask who did it.Paul sheepishly stood up and said ""It was me."" So did Raoul, and Donna, and Will, Scott, Miriam, Saba, Tim. Soon, everyone was standing.This felt like gaslighting, and should be illegal. There's nothing more toxic than employees banding together in solidarity.""Ok,"" I said. ""You're all fired except Donna.""They panicked. Suddenly Scott spoke out, ""that's not fair, because it was Donna who did it!""All the others piped up. ""Yeah it was Donna!""I already knew it was Donna, after going into my mind palace. I just wanted to test them.I fired Paul. I kept Donna on to send a message.Never pull a Spartacus on me. Julius Caesar was a fucking choirboy compared to me.",Ken Cheng,0,0,https://www.linkedin.com/in/ken-cheng-991849b6?miniProfileUrn=urn%3Ali%3Afsd_profile%3AACoAABivhj0By6q1ONB6QeqR4XBHHsD0L3A9vLc
"A woman applied to a sales job at my company. She had ""BIG NATURALS"" listed in her skills on her CV. I hired her on the spot.Why? Because of her big naturals?No, because she had amazing qualifications and 15 years of experience.You automatically assumed she didn't and I only hired her for her big naturals.That's very sexist of you.Women with big naturals can be intelligent too.And does she have big naturals? I don't know, I've not noticed. I don't see breast size.What she does have is huge brains and amazing sales figures. Those are the only big naturals I care about.Women 👏 are 👏 so 👏 much 👏 more 👏 than 👏 their 👏 big 👏 naturals.That's something only years of therapy has taught me.",Ken Cheng,0,0,https://www.linkedin.com/in/ken-cheng-991849b6?miniProfileUrn=urn%3Ali%3Afsd_profile%3AACoAABivhj0By6q1ONB6QeqR4XBHHsD0L3A9vLc
"Would you rather:a) never have sex again ever in your life?orb) no longer have your own executive bathroom at workI'd take a) in a heartbeat.It's incredibly important I do my business away from my employees for several reasons.1. My private bathroom is my inner sanctum. It's where I can reach inner peace and generate million dollar ideas.2. My workers cannot see or hear me poop. It would weaken me.3. The composition of a CEO's waste is highly different from regular folk, thanks to a more sophisticated diet and my overall successful lifestyle. If I went near non-CEO faeces, my immune system couldn't take it and I could well die.For those reasons, it's imperative I keep my own bathroom, and I don't let a single employee use it even if the main office one is ""out of order"".Whatever, go find a Starbucks, Patrick.",Ken Cheng,0,0,https://www.linkedin.com/in/ken-cheng-991849b6?miniProfileUrn=urn%3Ali%3Afsd_profile%3AACoAABivhj0By6q1ONB6QeqR4XBHHsD0L3A9vLc
"I called in one of my employees to fire him. He changed my mind using just 6 simple words.Eddy showed up to an important meeting with a big client wasted. He insulted their CEO, ate 12 of the communal pastries and then soiled himself.I asked Eddy to tell me why I shouldn't fire him. He said,""It was my evil twin, Ricardo.""That's all he needed to say. I let Eddy stay on at my company.Now, I'm not stupid. I knew Eddy didn't have an evil twin Ricardo because Eddy cheats on his wife and commits tax fraud, so he is evil enough already.However, I do believe in second chances, and Ricardo is a perfect metaphor for that.We all deserve an ""evil twin Ricardo"" once in our lives.",Ken Cheng,0,0,https://www.linkedin.com/in/ken-cheng-991849b6?miniProfileUrn=urn%3Ali%3Afsd_profile%3AACoAABivhj0By6q1ONB6QeqR4XBHHsD0L3A9vLc
"We've all seen some deranged posts on LinkedIn: Executives laying bare harsh cost-cutting measures like prizes, people talking about their divorces, and desperate attempts to find work. It's made LinkedIn posts fodder for Reddit and X. But now, some are spinning the style, satirizing it and posting from comedic accounts on LinkedIn. It caught my eye and made me wonder: Can a professional networking platform known for humble bragging and cringe posts be funny on purpose?ForBusiness Insider, I chatted with some of the comedians who are satirizing corporate culture and the grind mindset. It's a vibe that's become more mainstream post-peak pandemic, as people question their relationships to work.https://lnkd.in/eu8dKc5r",Amanda Hoover,0,0,https://www.linkedin.com/in/ken-cheng-991849b6?miniProfileUrn=urn%3Ali%3Afsd_profile%3AACoAABivhj0By6q1ONB6QeqR4XBHHsD0L3A9vLc
"I got my pants pulled down in public as a prank.My school friend loves to prank me inappropriately every time we meet up, and exposed my ass and genitals to a crowd in a busy shopping centre.Luckily, I came prepared. I got my company name and logo tattooed on my buttocks and balls.A humiliating prank? No, free advertising for me.Everyone was looking. You can't even dream of getting that many eyeballs with a regular ad.I saw a lot of people googling the company afterwards. Insane follow through.If you've ever had your whole dick and balls shown in a public space and you didn't capitalise, why are you even in business?",Ken Cheng,0,0,https://www.linkedin.com/in/ken-cheng-991849b6?miniProfileUrn=urn%3Ali%3Afsd_profile%3AACoAABivhj0By6q1ONB6QeqR4XBHHsD0L3A9vLc
"My stepdaughter tried to put poison in my food several times. I hired her. Here's why.My second wife had a 13 year old daughter when we met. She really hated me.She knew I was deathly allergic to peanuts and sprinkled peanut shavings into my food on several occasions. I almost died.Most stepparents would ground this child, but I respected her. Why?1. It shows a solutions oriented mindset. I'd respect her less if she hated me and didn't try to kill me.2. Giving someone a job is the best way to stop them murdering you. She is then dependent on you, plus nobody has ever hated their boss.3. It highlighted a security flaw. I had been complacent in not checking my food for peanuts every meal, which left me vulnerable to my enemies.Keep your friends close, keep your stepdaughters who have almost taken your life closer. You learn more from them.",Ken Cheng,0,0,https://www.linkedin.com/in/ken-cheng-991849b6?miniProfileUrn=urn%3Ali%3Afsd_profile%3AACoAABivhj0By6q1ONB6QeqR4XBHHsD0L3A9vLc
"I tripped a child during an egg and spoon race. No one saw. It was exhilarating.It was our company annual picnic last week (we do it in October to avoid the busy season).We end it with an egg and spoon race for the families, and Trevor's grandson was out in front. I've never liked Trevor, so I stuck out my leg to trip the boy. I wasn't even running in the race.Instead, Wallace won - our head of accounts. Great guy. Everything was right again.I can now understand why people do insider trading. I felt a lot of immense power in that moment, being able to turn the tides of history with one measly foot. It was against the rules, but it felt amazing.Of course, I would never partake in insider trading myself, just like how I would never trip up a small boy in an egg and spoon race.😉",Ken Cheng,0,0,https://www.linkedin.com/in/ken-cheng-991849b6?miniProfileUrn=urn%3Ali%3Afsd_profile%3AACoAABivhj0By6q1ONB6QeqR4XBHHsD0L3A9vLc
"An ex-employee described working at my company as Sisyphean, and maybe that's only a good thing?Yes rolling that boulder up that hill is tough work, but someone's got to do it and each time you do you get stronger bigger glutes.Unlike Sisyphus though, my employees only have to roll the boulder for half the day, then they can go home and play video games.And they have something Sisyphus never got: the chance of career progression.If they push that boulder enough times, they might be allowed to oversee Sisyphus doing it instead, and punish him if he's not working.If they're lucky, they can one day be in a position to manage hundreds of Sisyphuses, making sure they are all pushing the boulder well enough, then they won't even need video games because they won't have enough free time.Suddenly, being Sisyphus doesn't sound so bad, right?",Ken Cheng,0,0,https://www.linkedin.com/in/ken-cheng-991849b6?miniProfileUrn=urn%3Ali%3Afsd_profile%3AACoAABivhj0By6q1ONB6QeqR4XBHHsD0L3A9vLc
"I was walking through the park carrying £10,000 in cash in a briefcase when I looked at the surface of the lake and saw another man who looked just like me, also holding a briefcase full of cash.In my excitement I reached in to grab his briefcase and in the process I accidentally dropped my own briefcase in the water.""Help!"" I screamed to passersby. ""The lake man stole my briefcase!""A woman who was on a run immediately dived into the lake. After a few minutes she reemerged having fished it out and handed it back to me.""Thank you, how can I ever repay you?"" I asked, hoping my thanks was enough.""Buy me dinner?"" She replied, coyly.I did. She became my third wife and mother of my fifth child.Not every accident where you drop £10,000 into a lake is bad.And what about the money? Waterproof briefcase.I never make the same mistake twice.",Ken Cheng,0,0,https://www.linkedin.com/in/ken-cheng-991849b6?miniProfileUrn=urn%3Ali%3Afsd_profile%3AACoAABivhj0By6q1ONB6QeqR4XBHHsD0L3A9vLc
"You can make a fortune from being a professional airline bumper if you're smart.Many flights overbook and then offer passengers large amounts of compensation to get bumped. This can be as high as £10k.If you target it right, you never have to work a day in your life. All you have to do is spend 10 hours a day travelling to specific airports.I tried this in my 20s. I found a very busy flight around Christmas because that's when most people are travelling. I risked missing seeing my newborn child at Christmas to do this.There was a problem though.I was too attractive to be bumped.The flight attendant took me aside and said ""sorry sir, I'll let you in on a secret. You're too hot to not be let on this plane. We only bump the ugliest passengers.""Very frustrating. I wasted all this money on a ticket AND I had to go see my stupid new child.The pro-bumper life was not for me, but it can be for you if you're a total uggo.",Ken Cheng,0,0,https://www.linkedin.com/in/ken-cheng-991849b6?miniProfileUrn=urn%3Ali%3Afsd_profile%3AACoAABivhj0By6q1ONB6QeqR4XBHHsD0L3A9vLc
"It's true what they say: Gen Z are the most difficult generation to work with.They just do not respect authority the way their predecessors do, and that is a problem.Last month, during the staff training day, I set up an exercise that involved two employees.One was hooked up to an electric shock machine and the other had to administer increasing degrees of electric shocks without questioning why.Not a single Gen Z employee would administer the shocks, citing their ""conscience"" as the reason.Insanely frustrating. The software industry moves fast and sometimes you need your employee to electrocute someone without time for an explanation.What is happening to the world? How can I expect to run a business properly if my workers won't put aside their values on human rights to do exactly what I say at all times?Gen Z are just not cut out for the workplace.",Ken Cheng,0,0,https://www.linkedin.com/in/ken-cheng-991849b6?miniProfileUrn=urn%3Ali%3Afsd_profile%3AACoAABivhj0By6q1ONB6QeqR4XBHHsD0L3A9vLc
"One of my female employees texted this to me. This is really really inappropriate.I know lots of people feel this way about me but do NOT feel the need to tell me.I'm a very good businessman and boss, and I know that is high breeding potential to many, but you do not have to sexualise it.I'm sick of not being able to walk from the office to the bathroom without being perved on.It is inhumane and disgusting to treat sexy CEOs this way.Some days I wish I was poor so I wouldn't get constantly hit on.Please be better.",Ken Cheng,0,0,https://www.linkedin.com/in/ken-cheng-991849b6?miniProfileUrn=urn%3Ali%3Afsd_profile%3AACoAABivhj0By6q1ONB6QeqR4XBHHsD0L3A9vLc
"I was giving a presentation to the whole office and it switched to another tab abruptly. It was porn.I was mortified. Many were sympathetic, laughed it off and said it was just a mistake and I'm only human.I even got a few DM slides from employees who were intrigued about my habits, but I decided to keep things professional at work by not replying until I was at home.However, one employee Geoff came in to tell me he found it a bit inappropriate that I had a porn tab open at work.I fired Geoff immediately.I find being judgemental of others' innocent mistakes to be a major red flag, and it was a perfect way to root that out.The twist?I pulled up that porn tab on purpose.I wanted to weed out the prudes with their outdated ""don't look at porn at work"" moralism. I'd never make a rookie error like that. I've been watching porn at work for 20 years.",Ken Cheng,0,0,https://www.linkedin.com/in/ken-cheng-991849b6?miniProfileUrn=urn%3Ali%3Afsd_profile%3AACoAABivhj0By6q1ONB6QeqR4XBHHsD0L3A9vLc
"Having children was the worst investment decision of my life.I have had 5 children and so far they have been a large drain on my funds.I've spent collective millions feeding them, clothing them and educating them.Their return on investment is still 0% even including my 3rd son Jeffrey's lemonade stand that I took 40% of.However, this morning I was watching my 4 year old get really excited about seeing a rainbow reflection in her glass of water for the first time.She decided to draw it, which put a smile on my face.Do these little moments of joy make the money spent worth it?Still no.I want my fucking money back. She better become a famous artist now.",Ken Cheng,0,0,https://www.linkedin.com/in/ken-cheng-991849b6?miniProfileUrn=urn%3Ali%3Afsd_profile%3AACoAABivhj0By6q1ONB6QeqR4XBHHsD0L3A9vLc
"The office kitchen Toaster is broken.My employees have been complaining for several weeks.Last week, one of them, my Assistant Head of Marketing tried to fix it themselves.He watched several online videos and sought help from his electrician brother-in-law on Skype.While fixing it, he electrocuted himself and had to be rushed to hospital.On the way to hospital, in his injured state, he thought up a brilliant marketing campaign for our products.We immediately put that into practice and our sales rose by 15%.As he lay in his hospital bed, he hit it off with a nurse, and now that nurse is his husband.Ladies and gentlemen, I broke that Toaster on purpose.Sometimes being a great boss means doing the unexpected and seeing what happens.",Ken Cheng,0,0,https://www.linkedin.com/in/ken-cheng-991849b6?miniProfileUrn=urn%3Ali%3Afsd_profile%3AACoAABivhj0By6q1ONB6QeqR4XBHHsD0L3A9vLc
"Giving someone a salary increase:❌ only makes them happy once a year❌ allows them to get complacent❌ they'll probably spend the money on drugsStealing their chair while they're on their lunch break and hiding it:✅ gives them a strong sense of urgency✅ keeps them on their toes✅ inspires a new form of thinking about the modern world that departs from the default sitting down mindset✅ very funny to do✅ saves the company money✅ no more chairAny time you're thinking of giving your employee a pay rise, hide their chair instead.hashtag#NoMoreChair",Ken Cheng,0,0,https://www.linkedin.com/in/ken-cheng-991849b6?miniProfileUrn=urn%3Ali%3Afsd_profile%3AACoAABivhj0By6q1ONB6QeqR4XBHHsD0L3A9vLc
"When first wife left me I didn't cry.When my parents got divorced I didn't cry.When I witnessed the birth of my firstborn child I didn't cry.When my best friend died in my arms during war I didn't cry.Today, I did cry.Why?I read that the government had closed a tax loophole I was using to avoid paying as much capital gains.Thinking about all those wasted funds going to public services brought me to tears.I told some friends about this but they weren't very receptive, but I guess the world just isn't ready for a man who is in touch with his emotions.It's okay for men to cry when the world takes away something you love: untaxed profit.",Ken Cheng,0,0,https://www.linkedin.com/in/ken-cheng-991849b6?miniProfileUrn=urn%3Ali%3Afsd_profile%3AACoAABivhj0By6q1ONB6QeqR4XBHHsD0L3A9vLc
"I got kicked out of my friend's book launch yesterday.My friend writes mystery crime novels and is releasing a new one and threw a little party so I went along for the free wine.I actually don't like murder mysteries because I can see the ending a mile off. I got in a heated argument with the author about this.Me: ""I bet you £100 I can work out who the killer is from only reading one page.""Her: ""which page? As long as it's the first page and not the last page you have a deal.""Me: ""the bet is off."" My plan was to read the last page.I then tried this on someone else and they weren't as smart and agreed.I skipped to the last page but there was no hint to the killer, so I lost the bet.As I went to get my wallet from my bag someone noticed I had palmed 3 full bottles of wine.I was escorted out of the building. Sometimes you shoot for the moon and miss.",Ken Cheng,0,0,https://www.linkedin.com/in/ken-cheng-991849b6?miniProfileUrn=urn%3Ali%3Afsd_profile%3AACoAABivhj0By6q1ONB6QeqR4XBHHsD0L3A9vLc
"I learned a lot when my 11 year old son was abducted at sea. I always warned him not to go into the ocean, but he was too adventurous.I was determined to find him, so I went on a perilous journey, chasing the boat that took him.I met so many interesting characters along the way, including a woman with short term memory loss and a group of recovering addicts.I had lost all hope, but then a series of tip offs led me to his location.I found him in a dentist's office in the city, and he had found a lot of new friends and his confidence.It was then I realised I had been too protective of my boy, and he had now become a man.Funny, it was him who ended up teaching me an important lesson: always let your child swim in dangerous waters alone.",Ken Cheng,0,0,https://www.linkedin.com/in/ken-cheng-991849b6?miniProfileUrn=urn%3Ali%3Afsd_profile%3AACoAABivhj0By6q1ONB6QeqR4XBHHsD0L3A9vLc
"I go to the sexual health clinic every 2 weeks to get a regular STI test, even when I haven't had sex for a year.Why?It's important to project an image of success even when you're failing.The same is true for business. Even if your business is in trouble, you need everyone to believe in you.That's why I also announce my STI test visits in the company newsletter, and bring it up at the biweekly meetings.""The company can't be in trouble, if our boss is getting laid this often.""Jokes on them. I'm not getting laid at all and the company is going into liquidation.But the important part is no one knows either of those. The truth is what you make it.",Ken Cheng,0,0,https://www.linkedin.com/in/ken-cheng-991849b6?miniProfileUrn=urn%3Ali%3Afsd_profile%3AACoAABivhj0By6q1ONB6QeqR4XBHHsD0L3A9vLc
"Ken Chengis a professional comedian, but you'd only know that if you spent 5 seconds googling himThat's way too much to ask of r/linkedinlunaticsJoin Ken and I for a conversation about everybody's favorite subreddit",Chris Bogue,0,0,https://www.linkedin.com/in/ken-cheng-991849b6?miniProfileUrn=urn%3Ali%3Afsd_profile%3AACoAABivhj0By6q1ONB6QeqR4XBHHsD0L3A9vLc
"99.99999999% of sperm don't make it. It's only the elite sperm that rises to the top and succeed.This statistic is the same in business.Most entrepreneurs fail, either falling behind the fastest swimmers like myself or launch their company into a toilet bowl only to be flushed away.I was one of the elite few that made it.I still remember being a little sperm, racing past my competitors, because I had a single goal in mind: get to the egg.That determination. That tenacity. That pace.With that same determination, you'll be able to achieve anything you want, whether it's impregnating an egg or setting up a box park retail store.I was The Sperm That Lived.Be that sperm.",Ken Cheng,0,0,https://www.linkedin.com/in/ken-cheng-991849b6?miniProfileUrn=urn%3Ali%3Afsd_profile%3AACoAABivhj0By6q1ONB6QeqR4XBHHsD0L3A9vLc
"The haters have finally come for me (see pic below).In the same way the Romans were not ready for Jesus, the world truly is not ready for my teachings.It's true what they say. Sufficiently advanced Linkedin wisdom is indistinguishable from magic.I have turned water (bad LinkedIn posts) into wine (life changing wisdom that will get you laid).And now I know exactly what it's like to be crucified.If they ban my posts from r/linkedinlunatics, it'll be no different from nailing my wrists to a giant LinkedIn Logo.First they came for the LinkedIn CEOs, and you did not speak up because you're not as rich as me.Well it is time now to speak up.",Ken Cheng,0,0,https://www.linkedin.com/in/ken-cheng-991849b6?miniProfileUrn=urn%3Ali%3Afsd_profile%3AACoAABivhj0By6q1ONB6QeqR4XBHHsD0L3A9vLc
"It's time to speak up against rigged raffles at charity events.I bought 25 tickets to a raffle yesterday, hoping to score big.The raffle winners were drawn by a 9 year old child which I didn't question.As the prizes started being read out, more and more started going to different volunteers of the event.Then, I realised the child was the daughter of one of the volunteers.I'd heard about this: children who were well trained in the art of sleight of hand from birth.The last straw was when the child was the winner of my most wanted prize.I called the police.I told them there were several counts of child labour, children involved in gambling and the illicit rigging of the charity raffle.When the police showed up, it caused such a commotion that I used the opportunity to wrestle the prize off the child (she had magic fingers but she was weak).I ran home, clutching my new prized Lego Minecraft set.I will always seek to call out injustice, no matter how small.",Ken Cheng,0,0,https://www.linkedin.com/in/ken-cheng-991849b6?miniProfileUrn=urn%3Ali%3Afsd_profile%3AACoAABivhj0By6q1ONB6QeqR4XBHHsD0L3A9vLc
"As I currently wade through my third divorce I think about what lessons I can learn from it in business, and how I can bring DIVORCED energy to the workplace.D - Determination (I now have way more time to work now that I am alone)I - Integrity (I will act with complete integrity unlike when I cheated on my ex-wife)V – Vision (I will use my vision to ogle my attractive employees more)O – Opportunity (I will have the opportunity to play PS5 and finish Spider-Man)R – Resilience (I will cry less often)C – Creativity (I will find creative ways to act out my insecurities on my employees and make their lives hell to fuel my ego instead of seeking therapy)E – Efficiency (I am now sleeping in my office, which saves time)D – Divorced (I am divorced)How are you being DIVORCED in the business sector today?",Ken Cheng,0,0,https://www.linkedin.com/in/ken-cheng-991849b6?miniProfileUrn=urn%3Ali%3Afsd_profile%3AACoAABivhj0By6q1ONB6QeqR4XBHHsD0L3A9vLc
"If I had to choose between:a) £1 million in cashorb) getting my gooch tickled by Albert EinsteinI would choose b). No question.I've received £1 million many times, but the experience of the smartest man ever to live reaching down and lightly touching your taint would be unique and irreplaceable.Go hog wild, Einie.",Ken Cheng,0,0,https://www.linkedin.com/in/ken-cheng-991849b6?miniProfileUrn=urn%3Ali%3Afsd_profile%3AACoAABivhj0By6q1ONB6QeqR4XBHHsD0L3A9vLc
Yes I would pay my workers less than minimum wage.Yes I would dodge my taxes if it was legal.Yes I would make my employees work 80 hours a week.Yes I would build a Terminator-like robot to hunt down my competitors.Yes I would also use it on anyone who skives off work to go to the football.Yes I would employ child labour.I'm not perfect.That's why these laws exist.I'm a human with human needs and human flaws.And it's okay to admit that.No one else is brave enough to.,Ken Cheng,0,0,https://www.linkedin.com/in/ken-cheng-991849b6?miniProfileUrn=urn%3Ali%3Afsd_profile%3AACoAABivhj0By6q1ONB6QeqR4XBHHsD0L3A9vLc
