text,date,likes,comments,url
"I took 2 bags of old clothes to the nearest recycling bin about a mile away.When I got there, the bin wasn't there.I had walked 20 minutes in the sweltering sun carrying these heavy bags for nothing.The nearest suitable bin was now 2 miles away.Then it hit me.This must be what it's like being poor.Two giant bags weighing you down.Making your life harder.Everything is slower and tougher.This opened my eyes completely.I dropped the bags then and there right in the street.Why choose to be poor?Simply drop the bags.",Ken Cheng,0,0,https://www.linkedin.com/in/ken-cheng-991849b6?miniProfileUrn=urn%3Ali%3Afsd_profile%3AACoAABivhj0By6q1ONB6QeqR4XBHHsD0L3A9vLc
"I caught a thief stealing a package using my home security camera.The police did nothing.They said they don't deal with thefts of items with such low value.What happened to society? I had the thief's face on camera and everything.I decided to track the thief down myself.Eventually after several months, I found him.""I know you stole my trainers.""The thief panicked. ""Please don't report me to the police.""""I would never do that,"" I said. ""Instead, I have a job proposal for you. The website I bought the trainers from gave me replacement ones for free. I want to hire you to steal packages from outside my house every week. I will then sell the extra item and we split the profits.""At first, he was sceptical, but even he could see this was a great offer.Over the course of years, we made £5,000 in free replacement items together. Not only that, we got close, we bonded.I gained a lot from this experience. Mainly, over 5 hours of footage of him stealing things from outside my house on a weekly basis.That was ""high value"" enough for the police to put away this man for years.When he tried to tell him the truth, they thought he was insane.Never steal from a man who is willing to do anything for petty revenge.",Ken Cheng,0,0,https://www.linkedin.com/in/ken-cheng-991849b6?miniProfileUrn=urn%3Ali%3Afsd_profile%3AACoAABivhj0By6q1ONB6QeqR4XBHHsD0L3A9vLc
"I went to the zoo today. Boring.Animals are nowhere near as interesting as people, because they don't understand business.Animals don't set up companies or hire and fire each other.Animals don't attend conferences and host seminars.Animals don't make CVs or list their strengths and weaknesses.Animals don't have zoom meetings or know how to do an effective PowerPoint presentation.Animals don't have sexual harassment lawsuits.Animals don't plot and betray each other.I can get all that amongst my staff.There is nothing I gain from the zoo. It's for lesser minds who can't understand the nuance of office politics.Yes, you might catch two animals fucking. But I can easily watch two humans do that too.I have my own personal zoo. It's called my office window.Don't go to the zoo. Go to work instead.",Ken Cheng,0,0,https://www.linkedin.com/in/ken-cheng-991849b6?miniProfileUrn=urn%3Ali%3Afsd_profile%3AACoAABivhj0By6q1ONB6QeqR4XBHHsD0L3A9vLc
"I locked myself out of my house yesterday.I had two zoom meetings with very important clients and a huge deadline looming.I was in a panic.Then, I realised something.None of it matters.Meetings. Deadlines. Shareholders. What do these things mean?Are they really important to your being? Your soul?If I miss these things, will my life end? Will I cease to exist?None of it matters. It's all a game.Suddenly, I was calm. Calm enough to call an Uber Exec to my second house.I was early for my first meeting and they didn't even turn up.They were locked out of their house too.And they didn't have a second home.It's all a game and I'm winning.",Ken Cheng,0,0,https://www.linkedin.com/in/ken-cheng-991849b6?miniProfileUrn=urn%3Ali%3Afsd_profile%3AACoAABivhj0By6q1ONB6QeqR4XBHHsD0L3A9vLc
"My mother was fined for using the Blackwall tunnel without paying the charge.She found the payment system online confusing.Her penalty kept increasing because she didn't see any e-mails about it.It turned out she racked up £2,080 in fines.I told her to not pay it. I told her to fight.Yesterday, after 2 years of court appeals, she won.She didn't have to pay any fines. All it took was £750 in legal fees and months of court appearances.But that didn't matter.What mattered was, she chose to fight.Because she hired my law firm to fight it.Kerching.Always stay vigilant for any opportunity to make a quick profit.",Ken Cheng,0,0,https://www.linkedin.com/in/ken-cheng-991849b6?miniProfileUrn=urn%3Ali%3Afsd_profile%3AACoAABivhj0By6q1ONB6QeqR4XBHHsD0L3A9vLc
I'm in.,Ken Cheng,0,0,https://www.linkedin.com/in/ken-cheng-991849b6?miniProfileUrn=urn%3Ali%3Afsd_profile%3AACoAABivhj0By6q1ONB6QeqR4XBHHsD0L3A9vLc
"Bizarre first day atTechChoice.When I arrived at reception, I was greeted by two guards standing in front of two doors, speaking in unison.They asked me for my name and ID, and I asked if one of them only tells truths and one of them tells lies.They had no idea what I was saying and insisted there was only one of them.“Ah,” I said. “Both of you only tell lies then.”After 2 hours, my boss came down to sort this out.She insisted that I was hallucinating, possibly from the undercooked chicken I had this week.I insisted that she was a vampire because I saw her floating across the lobby.I told her to “prove it” by standing in front of a mirror. She stood next to the mirror next to the original guard (it was not two guards, he was just next to a mirror.)I finally arrived at my desk 4 hours into the day, and I was no closer to figuring out what Techchoice does.All I know is they love the “aaS” acronym as they deal in “UCaaS”, “DRaaS”, “IaaS”, “CCaaS”.I tried to make a joke out of this and said “I’m an aaS-man too”, but it got no laughs because I was talking to a plant.My boss said I should go home because I clearly had food poisoning.Jokes on her as I had done shrooms that morning.TechChoiceis an amazing company that may or may not specialise in buttstuff.",Ken Cheng,0,0,https://www.linkedin.com/in/ken-cheng-991849b6?miniProfileUrn=urn%3Ali%3Afsd_profile%3AACoAABivhj0By6q1ONB6QeqR4XBHHsD0L3A9vLc
"Pleased to announce I have joined the companyTechChoiceas their new Social Media Manager.They hired me to change the image of the company completely, ahead of their big rebrand.Let me be honest: I still have no idea what they do.Not one single idea.When they were explaining what they do, I started to zone out and think about the roast chicken I’m having later.If I had to guess, it was something to do with IT solutions, lemon and a small bunch of thyme.It was all a blur and my boss only stopped talking when she noticed me salivating at the mouth a bit.I was still thinking about the chicken.But I’m sure they’re a great company. The best company.You should go toTechChoicefor all your technology needs, unless they’re not actually involved in that, then don’t do that.I can’t believe how good they are at the things that they do in the field that they are in.TechChoice. There is no better choice, probably.",Ken Cheng,0,0,https://www.linkedin.com/in/ken-cheng-991849b6?miniProfileUrn=urn%3Ali%3Afsd_profile%3AACoAABivhj0By6q1ONB6QeqR4XBHHsD0L3A9vLc
"Say what you will about his actions, but a week ago I had no idea what Astronomer do.I still don't.This was utterly terrible marketing strategy.If I was going to get caught on kisscam I would've plastered my shirt with the logo.I would've tattooed the company website URL to my forehead.I would've mouthed the company motto as I snogged my head of HR.I don't blame this man for cheating.I blame him for awful business sense.The worst part? Him ducking out of view.He gave up free ad time and reduced his engagements by half.I completely support his right to have a sidepiece.I do not support his right to waste such a big opportunity for brand awareness.Disgusting.",Ken Cheng,0,0,https://www.linkedin.com/in/ken-cheng-991849b6?miniProfileUrn=urn%3Ali%3Afsd_profile%3AACoAABivhj0By6q1ONB6QeqR4XBHHsD0L3A9vLc
"I'm sorry to be the first to say it but:Ban all kisscams.They are intrusive.They are done without consent.And above all, they are ruining a CEO's fundamental right to take their head of HR to a public concert and embrace them in their arms.There is nothing wrong with that.I embrace my employees all the time and it is not sexual or romantic, especially the hotter female ones.I should be able to do that without judgement in public at, say, a baseball game or a beach hotel in the Bahamas.Enter the kisscam - the enemy of private staff bonding.Would you follow a CEO and his employee into their own homes and watch their private interactions?No. Do not watch this kisscam. Do not comment on this kisscam. Do not file for divorce just because of a kisscam.What happens on a kisscam is not canon.Ban all kisscams.",Ken Cheng,0,0,https://www.linkedin.com/in/ken-cheng-991849b6?miniProfileUrn=urn%3Ali%3Afsd_profile%3AACoAABivhj0By6q1ONB6QeqR4XBHHsD0L3A9vLc
"""We need to talk about male mental health.""No we don't. It doesn't exist.As soon as I hear any mention of a men's mental health, I leave the room.It's a lie propagated by my rivals to stop me overworking my software engineers.Software engineers do not have mental health.They once did a brainscan of one and found it virtually identical to machine code.What could they possibly get sad about?They're getting paid to be in front of a screen 15 hours a day.That's a man's dream.No, I don't buy it.The only thing a man is allowed to get sad about is if their dog is killed by the mob.Otherwise no, you don't have depression. Get back to work.",Ken Cheng,0,0,https://www.linkedin.com/in/ken-cheng-991849b6?miniProfileUrn=urn%3Ali%3Afsd_profile%3AACoAABivhj0By6q1ONB6QeqR4XBHHsD0L3A9vLc
"Apple spent $20 billion on their iPhone marketing budget last year.Samsung spent $25 billion on the Galaxy.Years ago, I threw a Motorola at my employee's head.They were dozing off during my presentation deck in a meeting.I threw the phone and it just missed, hit a fishtank and smashed it completely.The phone stayed entirely intact. No scratches.It made front page news.That month, sales for Motorola shot up 250%.CEOs everywhere had found the perfect phone that they can hurl at their colleagues.How much did it cost Motorola? Nothing.Cost to rent a billboard in Times Square for a day? $50,000.Some light physical abuse that showcases your product? Priceless.",Ken Cheng,0,0,https://www.linkedin.com/in/ken-cheng-991849b6?miniProfileUrn=urn%3Ali%3Afsd_profile%3AACoAABivhj0By6q1ONB6QeqR4XBHHsD0L3A9vLc
"A month ago I gave Sarah a promotion, a pay rise and the title of Employee of the Month.Today, I fired her. Why?She didn't follow the 2.22 rule.She didn't wait 2.22 seconds after saying goodbye before leaving the zoom call.If anyone is that eager to quit a zoom meeting, that's an unreliable colleague.That's why I have a secret ranking of all my employees where the only metric is Disconnect speed.Rafa has an average of ~2.24 seconds over 65 zoom calls, and he's only been working here 3 weeks.Rafa is my best friend now.It is a shame to lose Sarah, as she was spearheading a lot projects I'll have to cancel costing the company millions.But rules are rules. Don't leave the zoom 0.35 seconds after I say goodbye, crying baby or no crying baby.",Ken Cheng,0,0,https://www.linkedin.com/in/ken-cheng-991849b6?miniProfileUrn=urn%3Ali%3Afsd_profile%3AACoAABivhj0By6q1ONB6QeqR4XBHHsD0L3A9vLc
"I climbed into the meat fridge in the supermarket yesterday.Why?It's by far the best way to cool down in a heatwave for free.And here's the kicker: there is no rule against it.I was there for a good 15 minutes while the attendees told me to get out.I would've told them to ""get a lawyer"" but I didn't want to expend any energy.There was nothing they could do to stop me.Life is about finding loopholes.Ways to underpay your employees.Rivers to dump raw sewage.Refrigerators you can crawl into.I went back today and they had a sign up saying ""please do not climb into the meat fridge.""I smiled. This is my legacy.",Ken Cheng,0,0,https://www.linkedin.com/in/ken-cheng-991849b6?miniProfileUrn=urn%3Ali%3Afsd_profile%3AACoAABivhj0By6q1ONB6QeqR4XBHHsD0L3A9vLc
"IT technicians are the worst.I've had the same tech issue for 6 weeks.Several Fridays ago I sent an e-vite to all my employees.Not a single person showed up.The email must have been blocked.I've been in chats with Leonard the IT guy to figure out why.There was no feasible reason why my innocuous e-vite would be classed as spam.It was completely normal with no sexual references at all.I even promised to not bring up work chat, or pretend to fire someone because they beat me at Charades like last time (as I said on the Monday after, it was a joke.)Still, everyone said they hadn't seen it.Leonard insisted the system was working normally and then I asked if he'd seen the e-vite.He paused for 15 seconds then said no, proving this was an IT issue.It's now been 6 weeks with no resolution. I'm starting to think Leonard isn't worth the overtime I'm paying him to fix this.",Ken Cheng,0,0,https://www.linkedin.com/in/ken-cheng-991849b6?miniProfileUrn=urn%3Ali%3Afsd_profile%3AACoAABivhj0By6q1ONB6QeqR4XBHHsD0L3A9vLc
"I had a pizza at a restaurant yesterday.When it arrived I insisted it was the wrong way up.Why did I do this?Disruption.In 2025, you have to be disrupting the main narrative at any opportunity.I told the waiter ""toppings down"" is how it is meant to be served. I made him flip it over so the bread is on top.Eventually, he gave in.As the waiter nervously flipped the thing over, all the sauce and toppings went everywhere. It was a real mess - almost impossible to eat.But do you know what else is a mess? Business. Don't be afraid to make one.As I was leaving, I noticed about 3 or 4 other tables had flipped their pizzas over too.Always remember you have the power to change the narrative.Pizza toppings have had it easy for far too long. It's Upside Down Pizza's time to shine.",Ken Cheng,0,0,https://www.linkedin.com/in/ken-cheng-991849b6?miniProfileUrn=urn%3Ali%3Afsd_profile%3AACoAABivhj0By6q1ONB6QeqR4XBHHsD0L3A9vLc
"I’m looking forward to the 21st of July.Is it because of a major sporting event? Start of the Summer holidays? My son’s 5th birthday?None of those things can compare to the actual answer: it is, of course, the start of GMAT Week 2025.A series of online sessions to help students aiming to improve their GMAT test scores, all free and hosted byLeland.This is my Glastonbury. Nothing excites me more than four days of back-to-back Zoom seminars learning about Number Properties and Reading Comprehension strategies.Why do I love it so much? Because of the business opportunities.GMAT takers are the most desperate customers.Especially as I’m selling the GMAT answers.My uncle’s next door neighbour writes the GMAT test papers, and last year I was able to sell 5,000 copies to GMAT Week attendees.Then, I reported their names to my other business, a Cheating Detection Service, who boast a 100% success rate at finding cheaters in exams.Business goes up for them. Double profit.Plus, the integrity of the GMAT remains intact. Cheaters never prosper.Sign up here:https://lnkd.in/ds53WtPr",Ken Cheng,0,0,https://www.linkedin.com/in/ken-cheng-991849b6?miniProfileUrn=urn%3Ali%3Afsd_profile%3AACoAABivhj0By6q1ONB6QeqR4XBHHsD0L3A9vLc
"An employee asked me to have the afternoon off to take care of his sick girlfriend. I was immediately suspicious.I asked Ross to show me her. He loaded up a text message conversation with her.Sorry, but I was 100% convinced this was an AI girlfriend.I decided to call his bluff.I convinced him to let me drive him back to his house. He said it was over an hour away - coincidentally a long enough distance that would deter your boss from driving you to your house to check if your girlfriend was real.Not long enough for me.When I arrived I saw his girlfriend sick in bed. She looked very real. I needed to test if she was a robot.First, I asked her what her favourite film was. Just in case it was something like A.I., Bicentennial Man, or Robots, then I'd have her. She said Zootopia.Then, I tried saying what might be seen as a slur to a robots, to see if she'd get angry. I called her a ""skinjob"", a ""toaster"", a ""waffle iron"". Nothing.Lastly, I asked her if she knew what a stop sign looked like. She conveniently passed out then.After all this, I was still not 100% sure whether she was human or not.I had no choice but to let Ross have the day off, which was a disaster.The company couldn't really afford to lose someone that important for the whole afternoon.",Ken Cheng,0,0,https://www.linkedin.com/in/ken-cheng-991849b6?miniProfileUrn=urn%3Ali%3Afsd_profile%3AACoAABivhj0By6q1ONB6QeqR4XBHHsD0L3A9vLc
"I was dating the perfect woman for 3 months.I suddenly got the ick.We had amazing chemistry, shared values and similar net worths.I thought I'd marry her, and I've only thought that about 8 women in my life.Then it all changed.I watched her play Zip.Her time was 4 minutes 45 seconds.What the f--k?I'm usually forgiving but I knew instantly we were not compatible.If she can't Zip quickly, how can she raise a child correctly? What if our baby was on the line?I told her then and there it was over.I hope she found her way out of my apartment okay.",Ken Cheng,0,0,https://www.linkedin.com/in/ken-cheng-991849b6?miniProfileUrn=urn%3Ali%3Afsd_profile%3AACoAABivhj0By6q1ONB6QeqR4XBHHsD0L3A9vLc
"Why are you on LinkedIn on a Sunday?Go out and enjoy the time off.-Still reading?Congratulations, you're in the top 5%.Every second you are not on LinkedIn you're losing the race.Imagine a sprinter in a 100m taking their last 14 metres off.That's what you're doing when you log off.Meanwhile, the rest of elite few are still powering through.We will do anything to get ahead.We will miss out on a friend's birthday to send out 500 new connection requests.We will forget our anniversary to comment ""Very informative"" on posts we didn't read.We will give up monthly visitation rights to our first child to maintain our Zip streak.We have not seen a tree for weeks.We. Are. Winners.",Ken Cheng,0,0,https://www.linkedin.com/in/ken-cheng-991849b6?miniProfileUrn=urn%3Ali%3Afsd_profile%3AACoAABivhj0By6q1ONB6QeqR4XBHHsD0L3A9vLc
"IS IT OK TO CRITICISE A CANDIDATE'S HAIR?I interviewed a great candidate the other day, but they weren't the right fit.At the end, they asked us for feedback.I said it was his side parting.""Is that a business term?""""No, I mean your hair. It's atrocious.""He was taken aback. ""Why does that matter?""I explained. ""Listen, I have to look at your hair every day, and it would genuinely affect my job performance, and sink the company. Your hairstyle is so ugly it could cost us millions of pounds.""When I asked him if he would style it differently, he was outraged and left.Here's the thing: there was absolutely nothing wrong with his hair. I actually quite liked it.However, if somebody won't change their hairstyle to work for you, that's a bad sign.Like God testing Abraham, I was testing this man. He failed.",Ken Cheng,0,0,https://www.linkedin.com/in/ken-cheng-991849b6?miniProfileUrn=urn%3Ali%3Afsd_profile%3AACoAABivhj0By6q1ONB6QeqR4XBHHsD0L3A9vLc
"I watched a mosquito land on my arm and bite me.It reminded me of my employees.Take take take, with no give.Sucking away at my life force just so they can live.You know what? I don't mind.I lie awake at night, fully naked and uncovered, windows open. I let the mosquitos come.I have the same attitudes towards my workers. I let them take anything they want from me.Every time I hand someone their paycheck, it feels like they're jumping onto my body and digging their proboscis into my flesh. And I welcome it.Why? I can afford it.It gives me so much pleasure to know I am letting these parasites live off my success.I have so much blood to give.If you come work for me, I will let you suck me dry.",Ken Cheng,0,0,https://www.linkedin.com/in/ken-cheng-991849b6?miniProfileUrn=urn%3Ali%3Afsd_profile%3AACoAABivhj0By6q1ONB6QeqR4XBHHsD0L3A9vLc
"You don't just ""adopt a cat.""You also adopt business prospects from said cat.Thousands of studies have shown the power of feline pets to aid networking.When I meet any client I ask them about their cat and show them mine.This shared mutual interest is necessary to build cordial rapport.I have rearranged my entire image around my cat.My business card has a picture of my cat.My email signature was written by my cat.I have changed all my passwords to the name of my cat.Here's the thing: I actually hate cats. My children are deathly allergic.But I must soldier on. My company's needs come before my children's ""health"".And my company is nothing without cat.",Ken Cheng,0,0,https://www.linkedin.com/in/ken-cheng-991849b6?miniProfileUrn=urn%3Ali%3Afsd_profile%3AACoAABivhj0By6q1ONB6QeqR4XBHHsD0L3A9vLc
"I kissed one of my new employees recently.I did it for the company.Believe me, I took no pleasure in the kiss.It was simply good business practice.I knew it would increase her morale and productivity.It was clear it would fulfill her Maslow's hierarchy of needs.Self-actualisation - gives her a sense of purposeEsteem - the kiss is recognition for her good workLove and Belonging - intimacy she is missing from her husbandSafety - she felt safe in my armsPhysiological - she would have died if she didn't get to kiss meI personally hated the kiss, but I thought about the shareholders and powered through.Why is HR getting involved? Who I kiss in the workplace environment is none of their business.",Ken Cheng,0,0,https://www.linkedin.com/in/ken-cheng-991849b6?miniProfileUrn=urn%3Ali%3Afsd_profile%3AACoAABivhj0By6q1ONB6QeqR4XBHHsD0L3A9vLc
"I would like to call out numerous deepfake AI videos of me going around.I was not in a restaurant several weeks ago screaming at a waiter.I did not tell a waiter to send my dish back because my onions were diced incorrectly.I did not then proceed to call the waiter a ""beta cuck"" and hurl my chair at him.I definitely didn't then point at my shoe and say ""you see this piece of dirt on this shoe? It has more net worth than you.""I would never then crawl into a ball and start crying, screaming ""no one respects the King of Linkedin.""I categorically did not shout at the top of my voice ""First it's the onions, then it's our firstborn children.""I then absolutely did not wet my pants.This video and all corroborating other videos from different angles were fabricated, no matter how realistic they look.None of this happened. And even if it had, I would have well been within my right to react this way because onion size is important. But it never happened and I never did these things.Also fake is the video of me not turning up to my son's birthday.AI is very dangerous.",Ken Cheng,0,0,https://www.linkedin.com/in/ken-cheng-991849b6?miniProfileUrn=urn%3Ali%3Afsd_profile%3AACoAABivhj0By6q1ONB6QeqR4XBHHsD0L3A9vLc
"I got shadowbanned.Not from LinkedIn no.From somewhere far worse.My niece's birthday party.Shadowbanning is when you limit a user's post visibility without telling them.That's how it felt.I turned up and nobody wanted to talk to me.When I spoke I was often ignored.If I tried to start a conversation with niece's friends, an adult would whisk them away.Why?All because I tried to tell these 9 year olds about hustle culture.Or try to sell them my child-friendly crypto.As a man, being shadowbanned is worse than death.I don't know how but my sister in law did this to me.This sucks.",Ken Cheng,0,0,https://www.linkedin.com/in/ken-cheng-991849b6?miniProfileUrn=urn%3Ali%3Afsd_profile%3AACoAABivhj0By6q1ONB6QeqR4XBHHsD0L3A9vLc
"I stubbed my toe this morning on my way into work.It was on purpose.I do it every day before the start of my work day at 11:58am.Why?Because business is about failure as much as it is about success.I can't tell you how many times I've ""stubbed my toe"" as an entrepreneur.I've had whole companies go down in flames, employees' livelihoods destroyed, shareholder's investements completely wiped out. Just because of bad luck and my own decisions.That's painful.That's why I jam my toe against the elevator door.So I become ready for the pain.After stubbing my toe, I don't care how many new Dads or pregnant women I have to fire.I'm immune to it all now.Thanks, toe.",Ken Cheng,0,0,https://www.linkedin.com/in/ken-cheng-991849b6?miniProfileUrn=urn%3Ali%3Afsd_profile%3AACoAABivhj0By6q1ONB6QeqR4XBHHsD0L3A9vLc
"Months ago, my company was on the verge of financial ruin.Staff costs were high. We couldn't afford to pay everyone.What was the solution?Replace them with AI?No. The way out was much simpler:Start only hiring men into findom.Men into financial domination love to get underpaid.It feeds into their humiliation kink.And in finance, they aren't hard to find either.Just hit up any City of London bar after 9pm.Now, my legion of finance subs end up paying to work for ME.I cut our salary costs by 65%.Findom saved my company.",Ken Cheng,0,0,https://www.linkedin.com/in/ken-cheng-991849b6?miniProfileUrn=urn%3Ali%3Afsd_profile%3AACoAABivhj0By6q1ONB6QeqR4XBHHsD0L3A9vLc
