text,date,likes,comments,reposts,url
Course live now. $4999 for the next 24 hours. Check out cluely.university,20h,473,55,0,https://www.linkedin.com/in/roy-lee-goat?miniProfileUrn=urn%3Ali%3Afsd_profile%3AACoAAFdZSTQB7UqPnQv0aRN1T6Rg0w2FIav1FYo
Cluely billboards are now live in times square for the next 4 weeks. welcome back to school everyone! comment `handsome` and i'll dm u exactly how much this costs + who our billboard guy was,2w,3017,474,0,https://www.linkedin.com/in/roy-lee-goat?miniProfileUrn=urn%3Ali%3Afsd_profile%3AACoAAFdZSTQB7UqPnQv0aRN1T6Rg0w2FIav1FYo
"Just spent $100,000 on the new Cluely landing page. If you want to truly capture consumers, your design must be generationally good. I cannot think of a single legendary consumer app that did not redefine the landscape of UI/UX. Cluely will be next. Check it out for yourself: www.cluely.com",2w,1236,147,0,https://www.linkedin.com/in/roy-lee-goat?miniProfileUrn=urn%3Ali%3Afsd_profile%3AACoAAFdZSTQB7UqPnQv0aRN1T6Rg0w2FIav1FYo
"A 10-second clip of a girl on a virtual date got us over 6M views for Cluely. Here’s why it went viral (and how to make a viral UGC video): 1) It follows a viral hook format Every week, we have hundreds of UGC creators testing different viral formats and seeing what will go viral. As SOON as we spot a hook that works, we double-down and have our entire team of creators start making similar videos. This viral hook came after we noticed that brainrot videos of dating scenarios was working. 2) The video is actually funny Content has to either be extremely entertaining, relatable, or educational to go viral. This is not educational in the slightest but is very relatable and funny. Everyone has been on a horrible first date, and in no world is a video of a performative male trying to flex his minimum-wage McDonalds job not going to be entertaining. 3) It’s maximized for engagement This video has a MILLION different talking points for people to engage with. Beyond the actual interaction, we have on-screen Snapchat text, sped-up audio, and a caption designed to get viewers to comment. These small talking points ADD UP, and each contributes to its virality. This format is endlessly repeatable for UGC: Take the most absurd situation you think will go viral → tie in your product somewhere along the way. You can always make your content more converting. But it is very hard to make content more viral. Get something to a million views and worry about conversions later. video link: https://lnkd.in/gHUwDTtQ try Cluely free now: https://cluely.com/",3w,360,17,0,https://www.linkedin.com/in/roy-lee-goat?miniProfileUrn=urn%3Ali%3Afsd_profile%3AACoAAFdZSTQB7UqPnQv0aRN1T6Rg0w2FIav1FYo
"I genuinely just killed Leetcode. You've probably heard already, but Meta just announced they’re going to let candidates use AI in technical interviews. This is likely a direct result from this past year when I built Interview Coder ( the very first version of Cluely ), an invisible AI tool that let you pass Leetcode interviews using AI. I used it to get a bunch of tech offers, got ~200 million views online, got kicked out of school, and grew it to millions of dollars in revenue. Every day as this was happening, I would get anonymous DM's (and job offers) from some of the craziest names in tech. > Staff engineers at the biggest companies telling me that engineering leadership was seriously discussing me and the future of hiring. > Researchers at some of the biggest labs in the world telling me they were quiet supporters. > Senior engineers at so many random companies + startups asking if I wanted a job. There was honestly at least one staff level engineer from every single FAANG company who privately DM'ed me telling me I was changing the industry. It's an insanely vindicating feeling knowing that the dominoes are officially starting to fall for the death of Leetcode and quite surreal to think that, despite half the internet calling me low integrity and claiming I'd never change anything, I was responsible for an industry-wide shift. You can really do anything you want if you take risks and swing big. > Article: https://lnkd.in/gSsKFcrV > Interview Coder still live and STILL undetectable btw (will work until remote Leetcode interviews are truly truly dead): www.interviewcoder.com",3w,2525,116,0,https://www.linkedin.com/in/roy-lee-goat?miniProfileUrn=urn%3Ali%3Afsd_profile%3AACoAAFdZSTQB7UqPnQv0aRN1T6Rg0w2FIav1FYo
"six months ago, I ran this experiment unsuccessfully i'm hiring young, brainrotted high schoolers to make AI-generated content for Cluely if you're looking for something interesting + career-changing to do for the next month before school starts, please let me know comp will be paid per video, but you can expect to be paid extremely well the application is to find my email and send me the funniest ai generated video you can make this instagram account is the bar for what i find funny https://lnkd.in/gqwhjm8W",3w,278,36,0,https://www.linkedin.com/in/roy-lee-goat?miniProfileUrn=urn%3Ali%3Afsd_profile%3AACoAAFdZSTQB7UqPnQv0aRN1T6Rg0w2FIav1FYo
"Launching Cluely gave me the WORST impostor syndrome of my life. 3 months ago, I woke up every day wondering when Cluely would burn down and collapse. I felt a shit ton of pressure that I couldn’t achieve what I set out to do. If I could tell myself one thing during that time, it would be this: The ONLY thing that matters is that you keep going. When you take massive risks and bet on yourself (which is necessary to build anything meaningful), this feeling is inevitable. It feels like the whole world is collapsing on you every day, but it’s just your brain adjusting to a massive amount of change in your environment. If you decide to push through this feeling, things WILL start to click. Unfortunately, most people give up during this time and let this fear of failure block them from ever finding the momentum to make it work. This is self-sabotage and the biggest mistake you can make. Even now, while the fear is still there (it probably always will be), things become a little more stable every day. Impostor syndrome is all mental. Here's the first 5 members of the Cluely team, out for dinner.",3w,1467,72,0,https://www.linkedin.com/in/roy-lee-goat?miniProfileUrn=urn%3Ali%3Afsd_profile%3AACoAAFdZSTQB7UqPnQv0aRN1T6Rg0w2FIav1FYo
"Cluely now offers $500 cash referrals for dates. Here's the memo I sent out today: `@everyone NEW COMPANY-WIDE POLICY: If any employee refers a date for any other employee (that they are happy with), the referring employee will receive a one-time cash bonus of $500. This is infinitely stackable. ie if Ben refers a date to Neel whom Neel is happy with, and then subsequently refers a date to Brandon, whom Brandon is happy with, Ben would receive $500 + $500 = $1,000` Please message me directly if you find any members of the Cluely team attractive. Dating is, and will always be, an important part of our culture until we are all happily married.",3w,1391,115,0,https://www.linkedin.com/in/roy-lee-goat?miniProfileUrn=urn%3Ali%3Afsd_profile%3AACoAAFdZSTQB7UqPnQv0aRN1T6Rg0w2FIav1FYo
"If you’re uniquely good at ANYTHING, you can make millions $$$ right now. Here’s why: The internet has completely flipped what's valuable. The 16-year-old who shitposts and edits brainrot TikToks is now more valuable to a startup than a McKinsey consultant with 2 MBAs who’s never posted in their life. I’ve experienced it firsthand. This is what I believe I’m GENUINELY world-class at: 1. Engagement baiting on X 2. Handling online hate Two years ago, neither of these would’ve been considered valuable OR relevant for building a startup. These skills are now the meta for solving distribution at a startup. Thanks to the world being so different, your `superpower` that lets you get rich might be very very unique. You could be world-class at > Figuring out how to make a really funny Minecraft parkour Reddit story video > Making really funny reaction content to brainrot > Controversial street interviews Two years ago, these “skills” were just seen as being totally useless for society. Today, these people are PRINTING money for startups and running growth teams. The truth is that the idea space of what your “superpower” could be is WAY larger than you think. You just have to reframe the thinking that your weird talents aren’t worth anything. If you're exceptionally good at anything in present society, there's probably someone out there who would pay millions of dollars for that skill. Your job isn't to find a `normal` superpower. It's to find YOUR weird one and double down 1000x harder than anyone else would. P.S. If you do think you are exceptional, we will pay you top of market to work for us. Apply at https://cluely.com/careers",4w,498,43,0,https://www.linkedin.com/in/roy-lee-goat?miniProfileUrn=urn%3Ali%3Afsd_profile%3AACoAAFdZSTQB7UqPnQv0aRN1T6Rg0w2FIav1FYo
"psa to the few people in tech: THIS IS A TINY BUBBLE NORMIES DON'T KNOW WHAT CLAUDE IS AND HALF HAVE NOT TRIED CHATGPT TRY TO GET BILLIONS OF VIEWS, NOT MILLIONS SINCE 2022; CULTURE SPREADS THROUGH SHORT FORM. NOTHING ELSE A VIRAL X/LINKEDIN LAUNCH GETS 1 MIL VIEWS ONE TIME AND DIES THERE ARE EXTREME POWER LAWS IN ATTENTION LIKE NEVER BEFORE ENOUGH ATTENTION WILL MAKE U THE PRESIDENT OF USA EVERY AWARENESS EXPERIMENT SHOULD BE POTENTIALLY CAPABLE OF 1 BILLION VIEWS LOOK FOR POWER LAW OUTCOMES IN ATTENTION",2w,977,80,0,https://www.linkedin.com/in/roy-lee-goat?miniProfileUrn=urn%3Ali%3Afsd_profile%3AACoAAFdZSTQB7UqPnQv0aRN1T6Rg0w2FIav1FYo
"Cluely now offers $500 cash referrals for dates. Here's the memo I sent out today: `@everyone NEW COMPANY-WIDE POLICY: If any employee refers a date for any other employee (that they are happy with), the referring employee will receive a one-time cash bonus of $500. This is infinitely stackable. ie if Ben refers a date to Neel whom Neel is happy with, and then subsequently refers a date to Brandon, whom Brandon is happy with, Ben would receive $500 + $500 = $1,000` Please message me directly if you find any members of the Cluely team attractive. Dating is, and will always be, an important part of our culture until we are all happily married.",4w,1391,115,0,https://www.linkedin.com/in/roy-lee-goat?miniProfileUrn=urn%3Ali%3Afsd_profile%3AACoAAFdZSTQB7UqPnQv0aRN1T6Rg0w2FIav1FYo
"People put limitations on themselves WAY too early. In the past 6 months, I've learned more than at any other point in my life and destroyed the myth that certain skills are “unlearnable”. Prior to Cluely , I had never launched a successful startup. I had ZERO idea how to: > build enterprise-grade software > hire world-class talent > raise millions of dollars > go viral on social media I had 1,000 followers and failed at 3 previous startups. What I realized over time is that most of the things people say are `genetic` or `impossible to learn` are actually just really really HARD. Most people try something for 2 weeks, don't see immediate results, and quit while thinking they don’t have the talent for it. The difference between successful people and everyone else isn't genetic; it's the ability to wake up, be a LION, and work hard. If you're relatively smart and willing to work extremely hard, you can brute force your way to becoming skilled at nearly anything. There's a lion in everyone bro.",4w,886,83,0,https://www.linkedin.com/in/roy-lee-goat?miniProfileUrn=urn%3Ali%3Afsd_profile%3AACoAAFdZSTQB7UqPnQv0aRN1T6Rg0w2FIav1FYo
"You can have pretty much everything you want in life, as long as you 1) take risks and ignore what society tells you 2) work hard You want to be tall, jacked, and handsome? OK BET, get limb-lengthening surgery, take steroids, and get plastic surgery from a good surgeon. You might look at that and be disgusted, but really sit down and question why that disgusts you. Do you REALLY find it reprehensible to get cheek filler? Is that really much worse than being obese (normalized), playing video games 12 hours a day (normalized), or vaping (normalized)? Or is it just that society has told you these things are worse and you accept it as true? Many many people thought I was a weirdo at Columbia for constantly talking about wanting to build a startup. I've fully lost count of the number of times I've been called arrogant, narcissistic, cocky, delusional, etc. They're probably still calling me that on Sidechat. If I listened to the advice of these people, I'd be working today towards a life I did not want and would honestly be a loser. I'd have swallowed up my dreams, killed my ambition, and awkwardly agreed with everyone else: `haha yeah I was just joking! please accept me again! I'm a spineless loser who can't think for himself and be vocal about his thoughts and opinions!` So corny. If you can ignore the opinions of others, take big risks, and know EXACTLY what you're looking for, you can get everything you want in life. Know what you're looking for, and every once in a while, pause and reflect on whether you're actually working towards what you want. Everything you have ever dreamed of is one risky year away from who you are today. Yeah, I don't really know what this post is about. Cluely feeds you useful information live in meetings by the way. www.cluely.com PS here's a picture of TWO Chanel bags I bought my mom with my first bit of internet money.",1m,1041,80,0,https://www.linkedin.com/in/roy-lee-goat?miniProfileUrn=urn%3Ali%3Afsd_profile%3AACoAAFdZSTQB7UqPnQv0aRN1T6Rg0w2FIav1FYo
"Introducing web search in meetings with Cluely It feels like you’re predicting the future during meetings. Cluely predicts the info you want and gives you what you need, live, without asking. It listens in, understands the context, and surfaces useful info right when you need it, and can now predict when you'd need to search the web. When you meet people: >“I spent the last 4 years working at Astronomer” → Web search: Astronomer When someone lies to you: >“Sales tax is 14% this year in Georgia” → Web search: GA sales tax 2025 Check it out: www.cluely.com",1m,920,71,0,https://www.linkedin.com/in/roy-lee-goat?miniProfileUrn=urn%3Ali%3Afsd_profile%3AACoAAFdZSTQB7UqPnQv0aRN1T6Rg0w2FIav1FYo
my high school dropout intern is tough,1m,178,14,0,https://www.linkedin.com/in/roy-lee-goat?miniProfileUrn=urn%3Ali%3Afsd_profile%3AACoAAFdZSTQB7UqPnQv0aRN1T6Rg0w2FIav1FYo
"A startup truth I disagree with is that you shouldn't pay high cash comp. Cluely pays $250–350K base for designers and $300K–$1M base for engineers, and I'm certain this will be the new normal. Traditionally, the idea was to pay everyone below market, give them a tiny bit more equity, sell them on the `mission`, and hope they stick around. Here's why everyone is wrong (except me and Zuck): 1) You don’t need 100 people anymore. You need a few killers who move insanely fast. If you hire right and prioritize well, you can hit $10M ARR in under six months with under 20 people. 2) `Believe in the mission” is ALWAYS cope. You're 7 pivots deep into your `mission,` and I'm highly skeptical of every company mission. > Zuckerberg didn't dream of Meta -- he was a nerdy engineer who found something that worked and doubled down infinitely. > Larry and Sergey didn't dream of Google -- they found an interesting algorithm and doubled down infinitely > Early Airbnb employees were not putting their lives on the line to find better transportation accommodations for people at conferences. People never ever stay for the `mission,` but they MIGHT stay for the culture↓ 3) The only truly sticky part of an early stage startup for employees is how unique the culture and team is. There are many people who hate on Cluely , but one thing anyone will agree on is that if you ARE looking for a place like Cluely, you will not be able to find it anywhere else in the world. We work 12 hours a day, sponsor free Hinge premium, expense ALL dates, have a house full of influencers, and film content every single day. 4) You need risk/reward calculations to make sense if you expect 110% commitment. If the company goes well, founders will make 10-100x what the founding engineers make. You can't always bump upside; there's only so much equity in the company. But you CAN remove downside. And if you want everyone in the company to work as hard as you, you should. 5) There are very few winners in the startup space, and without exception, winning companies are built by the best people. If you want to win, you must be elite at everything. Including comp. Finally, most startup advice is garbage and you shouldn't listen to it (including this). What worked for anyone might not work for you, and spending 4 hours a day watching YC podcasts or re-reading Zero to One isn't going to help you. Everyone is wrong except you. Take big risks Work hard",1m,3121,180,0,https://www.linkedin.com/in/roy-lee-goat?miniProfileUrn=urn%3Ali%3Afsd_profile%3AACoAAFdZSTQB7UqPnQv0aRN1T6Rg0w2FIav1FYo
"If you don’t understand power laws, you will never build a successful startup. Here’s what I mean: In startups (and life), power laws dominate everything— the top 1% of actions create 99% of outcomes. These actions are so important that if you haven’t found them yet, your only job should be to find them. If you have, your only job is to double down. But most founders don’t do this. They get stuck chasing incremental, 10-20% improvements in random areas… and never find the things that actually meaningfully grow their company. When building Cluely , we ignored these small improvements and hunted exclusively for massive, needle-moving wins. This allowed us to focus our attention on finding the few bets that mattered most, and it’s paid off significantly: - 1% of our product ideas drove 99% of retention - 1% of our UGC creators generated 99% of views - 1% of our viral moments earned 99% of consumer mindshare Looking back, this is arguably the most important concept I’ve learned from building startups, and I look for it everywhere now. Every single experiment we conduct, I think about whether it has the potential to yield power law outcomes if proven correct. Will throwing a $1.5 million rave potentially yield power law outcomes in midnshare? Maybe. Will hiring a single world-class designer for $300k base salary result in potential power law outcomes in conversion? Perhaps. If you’re stuck optimizing things that won’t fundamentally move your company forward, stop. You don't need better optimization. You need a few massive wins. When something works, it'll be really obvious.",1m,624,73,0,https://www.linkedin.com/in/roy-lee-goat?miniProfileUrn=urn%3Ali%3Afsd_profile%3AACoAAFdZSTQB7UqPnQv0aRN1T6Rg0w2FIav1FYo
"I'm tripling the salary for founding designers Cluely . 250-350k cash + equity to be really good at Figma. I've removed every field in the job application except link to your portfolio and will review every application by hand. I only care about how good your work is. I do not care about school, experience, age, citizenship status, etc. Please be world-class. www.cluely.com/careers",1m,1755,175,0,https://www.linkedin.com/in/roy-lee-goat?miniProfileUrn=urn%3Ali%3Afsd_profile%3AACoAAFdZSTQB7UqPnQv0aRN1T6Rg0w2FIav1FYo
"6 months ago, I was NOT tuff. I had tried and failed at 3 different startups, was making no money, had ZERO (0) girls in my DM's, got rejected from the ASIAN frat because they thought I was weird, and the ratio at my birthday party was 1:4 (not tuff). I was stuck in this weird loop where I believed I would become successful, but had pretty much zero proof to show for it. Today, Cluely has raised over $20M backed by some of the biggest investors in the world, and has a genuine shot at being one of the fastest growing startups in the world. The past few months have FULLY changed my life, and it’s all happened incredibly quickly. Looking back, I think it’s a huge testament to one simple belief that I’ve developed: If you take big risks and work hard, the world will reward you. When you're unsuccessful, it can feel like success is impossibly far away. But the truth is, it can be a lot closer than you think. The successful people you see aren't actually as special as you think (me included). We just chose to make the risky decisions and commit fully - something that 99.999% of people don't do. If you're at a point where you're unsure whether to go all in or play it safe, bet on yourself and just keep going. Your entire life can change in a few months. Every day I wake up more and more convinced that regular people are capable of more than you think.",1m,2021,103,0,https://www.linkedin.com/in/roy-lee-goat?miniProfileUrn=urn%3Ali%3Afsd_profile%3AACoAAFdZSTQB7UqPnQv0aRN1T6Rg0w2FIav1FYo
"introducing Cluely for customer support. your support reps now know more about your company than you. Cluely hooks into your entire company knowledge base, listens in on the call, and sees your screen to give reps live guidance. 0 onboarding for new support reps. 0 user flows to memorize. start a pilot today in 2 minutes: www.cluely.com/enterprise",1m,1130,69,0,https://www.linkedin.com/in/roy-lee-goat?miniProfileUrn=urn%3Ali%3Afsd_profile%3AACoAAFdZSTQB7UqPnQv0aRN1T6Rg0w2FIav1FYo
"Everyone wants to talk about unique company culture, but no one embodies it like Cluely . Your work should be so fun and fulfilling it overpowers your life. WE are tough and will be the fastest growing company to $100M ARR in history. PS we are looking for the best Applied AI engineers in the world + cross-platform mobile app devs. www.cluely.com/careers article -> https://lnkd.in/gsA45dh6",1m,474,25,0,https://www.linkedin.com/in/roy-lee-goat?miniProfileUrn=urn%3Ali%3Afsd_profile%3AACoAAFdZSTQB7UqPnQv0aRN1T6Rg0w2FIav1FYo
"Customer support just changed forever. For the longest time, I hated customer support calls. As a consumer, I wasted dozens of hours talking to reps who either didn’t know what they were doing—or didn’t have the product knowledge to actually help. Even on our own team, we struggled to outsource support because of how much training it required. While customer support can be useful (if done properly), it often ends up being a massive time-sink—with customers forced to wait while their issue gets escalated to someone who can actually help. Luckily, Cluely solves this. When you enable our AI desktop assistant, every customer support rep gets instant, perfect recall of your company’s entire knowledge base. They can resolve questions immediately without needing to escalate, delay, or transfer the customer to another department. This is the way customer support is meant to be done. Try it now: https://lnkd.in/g54SdMDd",1m,412,27,0,https://www.linkedin.com/in/roy-lee-goat?miniProfileUrn=urn%3Ali%3Afsd_profile%3AACoAAFdZSTQB7UqPnQv0aRN1T6Rg0w2FIav1FYo
"In the past week at Cluely , we kicked off a project that will change the course of AI. Here’s why: Every major AI model today shares the same two flaws: - They wait to be prompted instead of predicting the information you need. - They operate on very little context, usually restricted to text only. Instead, Cluely proactively surfaces the most useful prompts for you based on what you’re seeing, hearing, saying, and doing. And now, for the first time, we have the data to train models around this entirely new UX: a proactive AI instead of a reactive one. We're not building models to answer your questions. We're building  models that will predict which questions you have. If you’re a world-class engineer or researcher interested in building the next interface for human-computer interaction, let me know. We offer the most exciting company culture in the world. www.cluely.com/careers",1m,2000,98,0,https://www.linkedin.com/in/roy-lee-goat?miniProfileUrn=urn%3Ali%3Afsd_profile%3AACoAAFdZSTQB7UqPnQv0aRN1T6Rg0w2FIav1FYo
"One of my favorite aspects of Cluely is the product design. And yet… we don’t have an in-house designer. This is because we use Cluely to help design itself. As an AI screen overlay, it gives real-time feedback, helps me understand design principles, and allows me to ask questions all from the same tab. As a team of non-designers, it’s how we’ve been able to ship clean, user-friendly UX without any formal training. It’s like having a senior designer looking over your shoulder… minus the meetings. 🎨 If you want to become a better designer, try Cluely: https://cluely.com/",1m,401,31,0,https://www.linkedin.com/in/roy-lee-goat?miniProfileUrn=urn%3Ali%3Afsd_profile%3AACoAAFdZSTQB7UqPnQv0aRN1T6Rg0w2FIav1FYo
"Sales is one of the ultimate use cases for Cluely . When we raised our $5.3M seed round, we pitched our product as an AI desktop assistant for sales. This was 100% intentional. We knew how critical sales is to a company’s survival–and how often deals fall apart because a sales rep doesn’t know how to respond. That’s why we built our product to hear your audio, see your screen, and provide real-time guidance when it matters most. During a sales call, Cluely: - walks you through customer discovery - answers technical questions - handles real-time objections - instantly generates follow-up emails. - keeps your gaze focused on the same part of the screen It’s the ultimate unfair advantage in sales. Access it now: https://lnkd.in/g54SdMDd",1m,422,40,0,https://www.linkedin.com/in/roy-lee-goat?miniProfileUrn=urn%3Ali%3Afsd_profile%3AACoAAFdZSTQB7UqPnQv0aRN1T6Rg0w2FIav1FYo
"Just finished up our Cluely mansion offsite and had a good ol' time bonding with each other 🤪 . If you're interested in making content for Cluely and are confident you can go viral, hit me up and you'll be treated like royalty 😄 . hashtag # superpumped hashtag # mansion hashtag # offsite",1m,415,19,0,https://www.linkedin.com/in/roy-lee-goat?miniProfileUrn=urn%3Ali%3Afsd_profile%3AACoAAFdZSTQB7UqPnQv0aRN1T6Rg0w2FIav1FYo
