text,date,likes,comments,reposts,url
"We recently solved our biggest product challenge at Cluely . For the past 3 weeks, our team has been building a feature no one else in the market offers: Real-time meeting notes. While every other AI note-taker gives you notes after the meeting, we’re the first to deliver them live, during the call. Because Cluely can see your screen and hear your audio, it: > takes live notes for you > comes up with questions to ask so you can seem engaged > answers every question > overlays on the meeting so your eyes don't wander This completely changes how AI can support you in meetings—and I’m super excited for people to finally try it. It’s like having a second brain that pays perfect attention and remembers everything. 👉 Use it now: https://www.cluely.com",1m,447,32,0,https://www.linkedin.com/in/roy-lee-goat?miniProfileUrn=urn%3Ali%3Afsd_profile%3AACoAAFdZSTQB7UqPnQv0aRN1T6Rg0w2FIav1FYo
"Being around ambitious people will change your life. Earlier this year, I hosted a 3-day hacker retreat with 15 of the most talented builders at Columbia: Hackshack ( www.cuhackshack.com ) The premise was simple: Who can make the most money in one weekend? When I organized this, I’d just launched Interview Coder (cheating tool for technical interviews) and had grown to a 5-figure MRR in 9 days. I hosted this event because I wanted to surround myself with hyper-ambitious people who’d push me to take my startup to the next level. Surprisingly, it only took a couple of days in that environment to realize I’d been thinking way too small. The breakthrough came when I realized Interview Coder's core technology (an on-screen, undetectable AI) had massive potential beyond technical interviews. That sparked the idea for Cluely , the most ambitious version of Interview Coder that aims to redefine how people interact with AI. It’s been two months since launch, and we’ve already hit major revenue milestones ($6M ARR) and raised over $20M. If I hadn't deliberately created this high-intensity environment, none of this would have ever happened. Take this as a reminder: If you're ambitious, focus on surrounding yourself with other ambitious, high-agency people. The rest will figure itself out.",1m,978,36,0,https://www.linkedin.com/in/roy-lee-goat?miniProfileUrn=urn%3Ali%3Afsd_profile%3AACoAAFdZSTQB7UqPnQv0aRN1T6Rg0w2FIav1FYo
"PSA: Being “professional” is killing your company. In the past 2 months, Cluely has grown to $6M in revenue by ditching the idea that you need to be professional. When we launched Interview Coder (initial version of Cluely), we leaned into the controversial nature of it and used it to funnel our growth. When I got kicked out of Columbia, I publicized everything and went viral. Since then, we’ve spent millions on wild marketing stunts, hired some of the most unhinged influencers on the internet, and taken bigger risks than anyone else in our space. And that’s the whole point: If no one’s paying attention to your product, it might as well not exist. While most companies are busy being “respectable,” the ones that win are the ones willing to truly do different and authentic things. You’re already seeing the shift: → Elon Musk tweeting whatever he wants → Sperm Racing raising $1M+ and having a shot at becoming a real sport → Engineers in sweatpants building billion-dollar companies People aren’t craving another corporate brand; they’re craving authentic people who do interesting things. No one in the world ever thought, `I wish this company was less interesting and the founder was less honest.` If you’re building a company today, stop worrying about your reputation – and start focusing on getting attention. P.S. If you want to try the most “controversial” AI product in the world, go here: https://cluely.com/",1m,1300,108,0,https://www.linkedin.com/in/roy-lee-goat?miniProfileUrn=urn%3Ali%3Afsd_profile%3AACoAAFdZSTQB7UqPnQv0aRN1T6Rg0w2FIav1FYo
"Cluely 's interns make between $50/hour to $200/hour. Here’s why you should be paying your interns more money: In the past two months since launch, our interns have helped us scale to $6M ARR. They’ve gotten millions of views on social media, managed a crazy marketing budget, and helped us solve some of our hardest technical challenges. This wasn't an accident. It's what happens when you: - Hire extremely talented people - Pay them what they're actually worth - Hold them to super high standards I've never understood founders who expect 12-hour days and exceptional results from interns while paying them minimum wage. If you're underpaying high-performing interns, you're actively sabotaging your company's potential – and not saving your company much money. People work harder when they’re paid what they’re worth. P.S. We're hiring interns who want to be part of something insane. If you're ready to perform at the highest level, apply here: https://cluely.com/careers",1m,2027,77,0,https://www.linkedin.com/in/roy-lee-goat?miniProfileUrn=urn%3Ali%3Afsd_profile%3AACoAAFdZSTQB7UqPnQv0aRN1T6Rg0w2FIav1FYo
"Cluely (almost) got sued… After getting kicked out of Columbia and building an AI “cheating” tool, we’ve been in multiple situations where we could've had lawsuits thrown at us. Despite this, we've broken $6M ARR and are growing faster than ever. Looking back, this was mainly possible because of one person: Our lawyer. Kevin Cergol-Plotkin makes up the entire legal team at Cluely, and he’s gotten us out of ~5 insane lawsuits in the past 2 months. He’s hands-down the best lawyer I’ve ever worked with (or seen) and is extremely diligent with his work. If you’re trying to build a startup and need legal help, I couldn’t recommend anyone more. Take it from me: he will fight for your company like his life depends on it.",1m,1165,73,0,https://www.linkedin.com/in/roy-lee-goat?miniProfileUrn=urn%3Ali%3Afsd_profile%3AACoAAFdZSTQB7UqPnQv0aRN1T6Rg0w2FIav1FYo
"Introducing Cluely . Today marks the dawn of a world where you never have to think again. I’ve been kicked out of Columbia, blacklisted by Amazon, and gained billions of impressions in the past few months. Every single person I knew told me I was ruining my life. But I swung big, turned my side project into a real company, and turned controversy into over $5M ARR in 2 months. Now, I’m swinging bigger than I’ve ever done before. Cluely will transform the way humans use AI. Cluely lives in the background of your computer—reading your screen, eavesdropping on your calls, and surfacing the exact insights and questions you need before you even know you need them. No prompts. No delays. Pure, proactive superintelligence at your fingertips. The era of “ask and wait” is over. Proactive AI is here. P.S. Cluely isn’t in beta. It’s live and ready. Crash our site and see for yourself: https://cluely.com",2m,2311,129,0,https://www.linkedin.com/in/roy-lee-goat?miniProfileUrn=urn%3Ali%3Afsd_profile%3AACoAAFdZSTQB7UqPnQv0aRN1T6Rg0w2FIav1FYo
"Cluely gives every employee free HingeX (highest tier subscription). Every company would perform better if their employees weren’t single. When you’re single (and lonely), you simply can’t get work done efficiently. I speak from experience: The worst time of my life was when I got rescinded from Harvard and spent a year locked in my room, not speaking to anyone outside of my immediate family. I became super lonely and started losing my motivation to do anything meaningful. Having a partner would’ve solved this. When your employees aren’t lonely, they’ll work harder and be happier. And yes, we expense all dates on the corporate Brex card :) P.S If you want to join our team (and find a partner), apply here: https://cluely.com/careers",2m,1645,164,0,https://www.linkedin.com/in/roy-lee-goat?miniProfileUrn=urn%3Ali%3Afsd_profile%3AACoAAFdZSTQB7UqPnQv0aRN1T6Rg0w2FIav1FYo
"I’ve gone to community college, had my Harvard admission revoked, and gotten kicked out of Columbia. Here’s why I think college is a joke: - Everyone “cheats” When I was at Columbia, I used ChatGPT to cheat on pretty much every assignment – and I wasn’t alone. I never met a single student who didn’t use AI to get through their classes. The information you get with a “college education” is becoming increasingly irrelevant. - Admissions are a lottery I think it’s pretty clear that admissions promote diversity over true merit. The greatest example of this I’ve seen is from Zach Yadegari (18 y.o. with a 4.0 GPA & $30M ARR business who got rejected by 15/18 top colleges). There are countless stories like his that show how meaningless a college acceptance really is. - Top talent can be found anywhere Elite schools love to brand themselves as the birthplace for people who change the world. The truth is, the most talented people I’ve seen (and hired) didn’t come from prestigious universities – one of our best engineers is a random furry I met in community college. Talented people can be found anywhere, and your school name shouldn’t dictate where you’re able to work or your potential for success. I’ve said it before, and I’ll say it again: You go to college to find a co-founder and a wife. That’s it. P.S. We’re hiring – and we couldn’t care less about your college education. 👉 Apply here: https://cluely.com/careers",2m,911,58,0,https://www.linkedin.com/in/roy-lee-goat?miniProfileUrn=urn%3Ali%3Afsd_profile%3AACoAAFdZSTQB7UqPnQv0aRN1T6Rg0w2FIav1FYo
"So excited to announce the addition of our latest intern! He had a few stints at some smaller companies like Dropbox, Uber, Pinterest, and Yahoo, but I'm really excited to give Kevin the opportunity to pursue a more lucrative career with us!",2m,798,59,0,https://www.linkedin.com/in/roy-lee-goat?miniProfileUrn=urn%3Ali%3Afsd_profile%3AACoAAFdZSTQB7UqPnQv0aRN1T6Rg0w2FIav1FYo
"A year ago, I sent an email that changed the course of my life… After getting rejected from Nucleus Genomics for a SWE internship, I cold-emailed the CEO and offered to work for free. He said yes. That summer changed everything. For the first time in my life, I saw people my age building things that I didn’t even know were possible. Before that, I assumed I’d just take the safe route and get a full-time job in tech. But doing that single internship gave me the confidence to pursue building something of my own. Fast forward a year – I’m now building Cluely , one of the fastest-growing AI startups in the world. If I hadn’t taken the time to send that cold email, none of this would’ve happened. Take this as a reminder: rejection isn’t real, and you should always go after the things you want.",2m,4357,131,0,https://www.linkedin.com/in/roy-lee-goat?miniProfileUrn=urn%3Ali%3Afsd_profile%3AACoAAFdZSTQB7UqPnQv0aRN1T6Rg0w2FIav1FYo
"Announcing Cluely 's $15M fundraise, led by Andreessen Horowitz . I started this company three months ago with my best friend Neel Shanmugam and my roommate Alex Chen . Since then, we've done over a billion impressions across social media and generated millions of dollars in revenue. Cluely started as a tool to cheat on technical interviews. I used it to get offers at top tech companies, like Amazon, Meta, Tiktok, and Capital One. After posting about it publicly to market the tool, I got blacklisted from big tech and kicked out of Columbia University. But I immediately realized that the technology we built wasn't just a great tool for cheating on technical interviews; it's likely the future of how humans will interact with AI. Today, people are using Cluely in sales calls, meetings, recruiting, and so much more. The potential for AI is limited because it's stuck behind a chatbot. We're just getting started. If you're excited about the potential of AI beyond the limits of a textbox, and in our unique ability to consistently go hyper viral, check us out. We're hiring: www.cluely.com/careers .",2m,4377,225,0,https://www.linkedin.com/in/roy-lee-goat?miniProfileUrn=urn%3Ali%3Afsd_profile%3AACoAAFdZSTQB7UqPnQv0aRN1T6Rg0w2FIav1FYo
"Cluely just threw the most legendary party that never happened. We spent $20,000. Over 2,000 people showed up within 16 minutes. And then... the whole thing got shut down. Every single unit of SFPD (and even the National Guard) came to tell people to leave. If there’s anything to take away from this, you should just know that Cluely’s aura makes anything go viral… P.S. The drinks will be waiting for next time. https://lnkd.in/gHi7tY9f",2m,914,48,0,https://www.linkedin.com/in/roy-lee-goat?miniProfileUrn=urn%3Ali%3Afsd_profile%3AACoAAFdZSTQB7UqPnQv0aRN1T6Rg0w2FIav1FYo
"Excited to come out of stealth and announce stratify (YC X25) to the world ( Y Combinator ). Stratify leverages AI to autonomously recruit hundreds of users, conduct customer interviews, and analyze results in hours—not weeks. No more expensive focus groups, unresponsive surveys, or thousands of manual Zoom interviews. The future of user research is here: trystratify.com Reach out to founders@trystratify.com to speak with Pratham Hombal and I.",3m,357,87,0,https://www.linkedin.com/in/roy-lee-goat?miniProfileUrn=urn%3Ali%3Afsd_profile%3AACoAAFdZSTQB7UqPnQv0aRN1T6Rg0w2FIav1FYo
Excited to introduce the Cluely marketing team.,2m,2788,191,0,https://www.linkedin.com/in/roy-lee-goat?miniProfileUrn=urn%3Ali%3Afsd_profile%3AACoAAFdZSTQB7UqPnQv0aRN1T6Rg0w2FIav1FYo
Cluely is throwing the biggest YC Startup School afterparty. Mon Jun 16 10PM. Invite only. Dm me for a link.,2m,631,61,0,https://www.linkedin.com/in/roy-lee-goat?miniProfileUrn=urn%3Ali%3Afsd_profile%3AACoAAFdZSTQB7UqPnQv0aRN1T6Rg0w2FIav1FYo
"I’m building the future of AI with Cluely. In <2 months since our launch, we’ve scaled to over $5M ARR. If you’re scared of AI replacing your job, here are two things I recommend: 1) Take more risks. I don’t know what the world is going to look like in 5 years. Nobody does. But I do know that AI is quickly giving everyone access to the same tools, code, and creative shortcuts. This means that you if you want to set yourself apart, you need to be willing to take risks. Every single piece of success I’ve had over the past few months has come from trusting my gut when everyone else told me not to. 2) Learn how to go viral. AI makes it easier than ever to replicate products. What’s hard now is getting attention. That’s what people mean when they say “distribution is the last moat”. When we were brainstorming our first product (Interview Coder), we thought about what kind of product would go viral – and worked backwards. This strategy worked extremely well, and helped us break over $3M in ARR after getting hundreds of millions of views on social media. If you can learn to take massive risks and get the right people to see it, I genuinely believe the AI era will become the most rewarding time for you to be alive. P.S. If you want to see what the future of AI looks like, go here: https://cluely.com/",2m,323,15,0,https://www.linkedin.com/in/roy-lee-goat?miniProfileUrn=urn%3Ali%3Afsd_profile%3AACoAAFdZSTQB7UqPnQv0aRN1T6Rg0w2FIav1FYo
"I asked over 40 strangers to start a company with me before I met my co-founder… Here’s the story of how I met Neel: When I first transferred to Columbia (Fall 2024) I went up to every single person that I thought looked smart and asked them if they wanted to be my co-founder. I got tons of weird looks, “no’s”, and people telling me they weren’t interested. Neel was one of them. It was only after meeting again at a party that we started working together on small side projects (notetaking app, AI agent for liquor distributors etc) and realized we worked surprisingly well together. Eventually, we both decided that working a corporate job wasn’t for us and went all-in on startups. We launched Interview Coder (AI for cheating on technical interviews), farmed a ton of big-tech offers to go viral, and hit $1M ARR in 36 days. After that, we decided to build something much bigger. That’s when Cluely was born – an undetectable desktop assistant that feeds you answers in real time. It’s been under 2 months, and we already broke $5M in revenue and are on pace to become the fastest company to ever hit $100M ARR. Shoutout Neel 🫡 P.S. I partly made this post because he’s desperately single. If you’re interested, Neel’s DMs are open…",2m,2954,108,0,https://www.linkedin.com/in/roy-lee-goat?miniProfileUrn=urn%3Ali%3Afsd_profile%3AACoAAFdZSTQB7UqPnQv0aRN1T6Rg0w2FIav1FYo
"Earlier this year, I got kicked out of Columbia University , blacklisted at Amazon , and was questioning everything… For about a month. When I launched Interview Coder (AI for cheating on technical interviews), I live-recorded using it to pass my Amazon interviews, hoping it would go viral. It didn’t. The video flopped, Amazon rescinded my offer, and they contacted Columbia asking them to kick me out (which they eventually did). At this point, everyone in my life (including my co-founder) was telling me it wasn’t worth it to continue. This was probably the most stressful month of my life. I had no idea if things were going to work out, but I decided to listen to a voice in my head that was telling me to keep going. Soon after, Interview Coder went mega viral when I posted Columbia’s disciplinary notice online. We got millions of views on social media, broke 1M in revenue, and were later able to use the virality to springboard the launch of Cluely , our biggest bet in AI. Our vision is to create the ultimate desktop assistant, allowing you to directly integrate AI into sales meetings, video calls, and more. Since launching less than 2 months ago, we’ve gotten over 70,000 active users and hit $5M ARR. If there’s something I learned, it’s that you need to really swing big if you want a big result. Cutting off all my other opportunities (college, big-tech, etc) was the biggest risk I’d taken at the time, and I’m more glad than ever that I went all in. P.S. If you want to see the product that I’ve bet my life on, try it free here: https://cluely.com/",2m,347,27,0,https://www.linkedin.com/in/roy-lee-goat?miniProfileUrn=urn%3Ali%3Afsd_profile%3AACoAAFdZSTQB7UqPnQv0aRN1T6Rg0w2FIav1FYo
i approved this,2m,315,15,0,https://www.linkedin.com/in/roy-lee-goat?miniProfileUrn=urn%3Ali%3Afsd_profile%3AACoAAFdZSTQB7UqPnQv0aRN1T6Rg0w2FIav1FYo
"First round engineering interviews at Cluely are always extreme culture-fit rounds held directly by me. I ask a bunch of rapid-fire questions and the only intent is to judge if you'd fit in here with us. I try my best to keep our culture extremely unique. We only hire influencers and top-tier engineers, and most of us do not have college degrees.",2m,436,50,0,https://www.linkedin.com/in/roy-lee-goat?miniProfileUrn=urn%3Ali%3Afsd_profile%3AACoAAFdZSTQB7UqPnQv0aRN1T6Rg0w2FIav1FYo
"I've gone through >2,000 applications trying to hire for Cluely 's $200/hr software engineering internship (Summer/Fall). I've sent 11 invitations to interview. Here's what I think: - Most people have extremely poorly formatted resumes. If you're not using a common resume template, start. They're popular for a reason. - If your education is not eye-catching and your experience is not eye-catching, your Github better be eye-catching. This is the one thing that can separate a bad applicant from a good one and is the sole reason for over half of the invites I've sent. >99% of applicants have a completely horrible Github that is just unhireable. - Amazon hires a ton of people. The vast majority of you have zero proof anywhere on the internet that you enjoy programming or are able to program at all. hashtag # swe hashtag # softwareengineering hashtag # internship hashtag # summerinternships",2m,1243,145,0,https://www.linkedin.com/in/roy-lee-goat?miniProfileUrn=urn%3Ali%3Afsd_profile%3AACoAAFdZSTQB7UqPnQv0aRN1T6Rg0w2FIav1FYo
"Cluely is hiring software engineer interns for $200/hr. This is likely the highest paid internship in the world. Our vision is to create the ultimate desktop assistant that goes beyond chat, proactively predicting intent and surfacing information before you need it. We aim to make Cluely the default way people reach for AI help. This will involve difficult technical challenges. Some examples of problems we have solved or are working on right now at Cluely include: - Sub 100ms response times - Multimodal context compression/stitching - Solving proactive responses We are assembling an engineering team to match the caliber of our growth and marketing organizations, and to service the growth we are experiencing. We work out of a sunny office, offer free housing, food, and transportation. We are in-person and work hard six days a week. If you’re interested in pioneering the cutting edge of human-computer interaction, we would love to chat. If you think you're one of the best programmers of our generation, please apply! We also offer a $10,000 referral bonus for engineering interns. www.cluely.com/careers",3m,2047,131,0,https://www.linkedin.com/in/roy-lee-goat?miniProfileUrn=urn%3Ali%3Afsd_profile%3AACoAAFdZSTQB7UqPnQv0aRN1T6Rg0w2FIav1FYo
🥱ts this linkedin shit easy,3m,459,29,0,https://www.linkedin.com/in/roy-lee-goat?miniProfileUrn=urn%3Ali%3Afsd_profile%3AACoAAFdZSTQB7UqPnQv0aRN1T6Rg0w2FIav1FYo
thanks for another post Business Insider . you can say my name next time 😒😒,3m,199,18,0,https://www.linkedin.com/in/roy-lee-goat?miniProfileUrn=urn%3Ali%3Afsd_profile%3AACoAAFdZSTQB7UqPnQv0aRN1T6Rg0w2FIav1FYo
"Cluely is gonna be the fastest company to $100M ARR in history. We keep our revenue graph public so all employees can see what we're working for. Check out cluely .com/careers if you're interested in joining. ps there's a $25,000 referral bonus for founding engineers if we end up hiring someone you send our way.",3m,1078,45,0,https://www.linkedin.com/in/roy-lee-goat?miniProfileUrn=urn%3Ali%3Afsd_profile%3AACoAAFdZSTQB7UqPnQv0aRN1T6Rg0w2FIav1FYo
this is actually a useful product. used this during my zfellows batch; might genuinely be the future of photo sharing.,3m,110,4,0,https://www.linkedin.com/in/roy-lee-goat?miniProfileUrn=urn%3Ali%3Afsd_profile%3AACoAAFdZSTQB7UqPnQv0aRN1T6Rg0w2FIav1FYo
"finally an interview where i don't look fat. * hasn't been 5 months, we launched <1 month ago, and we haven't quite closed in on 5 mil arr yet. https://lnkd.in/g7sJn5_C",3m,491,24,0,https://www.linkedin.com/in/roy-lee-goat?miniProfileUrn=urn%3Ali%3Afsd_profile%3AACoAAFdZSTQB7UqPnQv0aRN1T6Rg0w2FIav1FYo
"introducing Cluely , the cheat on everything company. but our vision is a lot bigger than just cheating. we're trying to change the way humans think. it starts with asking: `what is the ultimate AI?` it should see what you see. hear what you hear. know everything you know, and give you answers before you even know you have a question. this is what we're building. an intelligence layer that lives with you. not a website you open. a presence you depend on. AI has already achieved superhuman capabilities, but we've trapped it behind a chatbot, stripped of context, and neutered by UI. Cluely will start with small things: homework, meetings, sales calls. a single shortcut response that makes you think `hey, that's pretty cool.` but soon, Cluely will be with you in every moment of your digital life. you’ll use it to write better. to decide better. to think better. to live better. Cluely is a new interface for cognition itself. This is the turning point of thought. check out our new website: www.cluely.com hashtag # ai hashtag # software hashtag # artificialintelligence hashtag # cognition hashtag # singularity hashtag # technology hashtag # futurism hashtag # startups hashtag # marketing hashtag # socialmedia hashtag # enterpreneurship",3m,949,59,0,https://www.linkedin.com/in/roy-lee-goat?miniProfileUrn=urn%3Ali%3Afsd_profile%3AACoAAFdZSTQB7UqPnQv0aRN1T6Rg0w2FIav1FYo
True. Humans have always felt uncomfortable with the rate at which technology grows. Call it cheating today — it'll be normal tomorrow.,3m,142,14,0,https://www.linkedin.com/in/roy-lee-goat?miniProfileUrn=urn%3Ali%3Afsd_profile%3AACoAAFdZSTQB7UqPnQv0aRN1T6Rg0w2FIav1FYo
"Cluely finally has a Crunchbase site now and it looks sick asf. Very cool to see how the project I developed in my dorm ( Interview Coder ) has grown to such a massive scale in a few short months. I think that the only difference from the me a year ago and the me today is that I have much more confidence in myself, and am much more willing to take bigger risks. If you're a student reading this and you've ever thought about doing startups, my singular piece of advice to you is to TAKE MORE RISKS. The world as we know it is changing on every single level. There is truly no better time to try something new and risky for yourself. The payoff is extremely disproportionate, and there is no summer internship that is more fun and exciting than building a company with your best friends. It is the best time in history to take risks.",3m,1075,39,0,https://www.linkedin.com/in/roy-lee-goat?miniProfileUrn=urn%3Ali%3Afsd_profile%3AACoAAFdZSTQB7UqPnQv0aRN1T6Rg0w2FIav1FYo
