text,date,likes,comments,reposts,url
"I've gone through over a thousand applications for a founding designer, and I've seen maybe 10 portfolios that were worth taking a second look at. I will pay $200k + equity for a world-class designer to drop everything, and work for Cluely . We hope to be the fastest company to $100M ARR in history and are making the boldest bets out there. We will pay you extremely well to do good work, and your work will get seen by hundreds of thousands of people. If you're interested, drop the link to your portfolio; we can move extremely quick. If you know a relevant friend who might be interested, tag them in the comments. We just wrapped up a new design for the landing page, so the screenshot you see below is the bar. If you can do better than this, please apply. hashtag # job hashtag # newgrad hashtag # tech hashtag # internship hashtag # graphicdesign hashtag # uiux hashtag # designer",3m,1291,208,0,https://www.linkedin.com/in/roy-lee-goat?miniProfileUrn=urn%3Ali%3Afsd_profile%3AACoAAFdZSTQB7UqPnQv0aRN1T6Rg0w2FIav1FYo
"CS JOB MARKET is very difficult. if you are a new grad or masters student know the gap between school and the real world is exacerbating especially in a world of AI agents, MCPs and model training. so today we launch an all-new Headstarter. whether you're a CS freshman or have 10 years of experience this revamp is designed to meet you where you are and take you further. check us out: https://www.headstarter.co . so here goes. let's go! hashtag # softwareEngineering hashtag # cs hashtag # advice hashtag # projects hashtag # computerScience",3m,1502,546,0,https://www.linkedin.com/in/roy-lee-goat?miniProfileUrn=urn%3Ali%3Afsd_profile%3AACoAAFdZSTQB7UqPnQv0aRN1T6Rg0w2FIav1FYo
"I'm hiring 50 growth interns for Cluely . $50/hr. San Francisco. Full-time. [ www.cluely.com/careers ]. This will be the most competitive summer you've ever had. Every single day, you'll be surrounded by the best of your generation and expected to perform at the highest level. If you underperform, you will be fired and replaced immediately. There will be no breathing room and no time for mistakes. You'll spend the summer in a house with 50 high school/college students with the most impressive backgrounds in the country, and every day your output will be measured, compared, and publicized. At bare minimum, you'll be required to make 4 Tiktoks a day. If you can't put your face behind a camera and talk, don't apply. If you can't send 200 custom LinkedIn connection requests for a chance at a sales call, don't apply. If you don't think you can learn how to program and ship production-level code in 3 months, don't apply. If there was even a single moment in reading this job description where you cringed or thought that this culture might be too competitive or too toxic for you, don't apply. We're looking for killers, and we are offering hugely competitive rates after recruiting has already ended. Apply at cluely.com/careers and send us an email at hello@cluely.com explaining what you're good at AND proof if you got this far (your application will get prioritized). hashtag # internship hashtag # newgrad hashtag # summerinternship hashtag # swe hashtag # programming hashtag # growth hashtag # startups hashtag # earlystage hashtag # venturecapital hashtag # siliconvalley hashtag # code",3m,2417,201,0,https://www.linkedin.com/in/roy-lee-goat?miniProfileUrn=urn%3Ali%3Afsd_profile%3AACoAAFdZSTQB7UqPnQv0aRN1T6Rg0w2FIav1FYo
"People are literally building companies to try and shut down Cluely LOL. You might think we're upset, but this is absolutely thrilling. There could be no better sign that we're actually disrupting things and forcing change. Give us a try and drown us in criticism; we're only getting better. https://lnkd.in/gNGGUnhX",3m,1499,69,0,https://www.linkedin.com/in/roy-lee-goat?miniProfileUrn=urn%3Ali%3Afsd_profile%3AACoAAFdZSTQB7UqPnQv0aRN1T6Rg0w2FIav1FYo
This is a fair post by Business Insider about Cluely 's initial limitations post-launch. The launch video went way more viral than we expected and usage tanked our servers. We just pushed load balancing + image compression and internal tests suggest an entire 3x improvement in response times since launch. We are shipping massive improvements every other hour and the entire team is working ourselves to death to make this product great. Much more about it coming soon. https://lnkd.in/eSc3uwRu,4m,239,24,0,https://www.linkedin.com/in/roy-lee-goat?miniProfileUrn=urn%3Ali%3Afsd_profile%3AACoAAFdZSTQB7UqPnQv0aRN1T6Rg0w2FIav1FYo
Icon is such a cool company. unreal.,4m,114,18,0,https://www.linkedin.com/in/roy-lee-goat?miniProfileUrn=urn%3Ali%3Afsd_profile%3AACoAAFdZSTQB7UqPnQv0aRN1T6Rg0w2FIav1FYo
"Announcing Cluely 's $5.3 million pre-seed round, co-led by Abstract and Susa Ventures . AI is about to change everything — not someday, but now. At Cluely, we’re building a world where you never have to think alone. An AI that’s always on. Watching your screen. Hearing your audio. Helping you communicate better, solve faster, and win more often. The world will call it cheating. But every major leap, from the calculator to the internet, looked like that at first. We believe AI is not a threat to human potential: it’s the greatest amplifier we’ve ever seen. This is the future we’re building. And we’re just getting started. → [ https://lnkd.in/gnHY_kQA ]",4m,2723,168,0,https://www.linkedin.com/in/roy-lee-goat?miniProfileUrn=urn%3Ali%3Afsd_profile%3AACoAAFdZSTQB7UqPnQv0aRN1T6Rg0w2FIav1FYo
"i got kicked out of Columbia for building Interview Coder , AI to cheat on coding interviews. now i raised $5.3 million to build Cluely , a cheating tool for literally everything. a completely undetectable AI that sees your screen, hears your audio, and gives you real-time assistance in any situation. interviews, assignments, tests, sales calls, meetings — everything. and tbh, i don't think this is cheating. every single time technology has made people smarter, the world panics. then it adapts. then it forgets. and suddenly, it's normal. but this is different. humanity is at an inflection point. AI will transform the entire world, and it will be more disruptive than anything we've ever seen. Cluely is the bridge to a world where humans don't compete with machines — we grow with them.",4m,6691,411,0,https://www.linkedin.com/in/roy-lee-goat?miniProfileUrn=urn%3Ali%3Afsd_profile%3AACoAAFdZSTQB7UqPnQv0aRN1T6Rg0w2FIav1FYo
"Cluely launches in <24 hours. We're changing the definition of the word `cheating.` Interview Coder broke every technical recruiting pipeline in the world. But what AI enables isn't just a transformation of technical interviews. It will redefine how our world works, upend every social structure, rewrite the rules of morality. Cluely is the most ambitious project of my life. If we can accomplish what we set out to, we will change the course of human history. 4/20/25 2PM PST",4m,2017,105,0,https://www.linkedin.com/in/roy-lee-goat?miniProfileUrn=urn%3Ali%3Afsd_profile%3AACoAAFdZSTQB7UqPnQv0aRN1T6Rg0w2FIav1FYo
"Cluely is the last project I will ever work on. Building Interview Coder was one of the most stressful and fulfilling experiences of my life. After I launched, there was a period of about 4 weeks where both Columbia and Amazon were upset with me, and I thought I'd blown up my entire career + education for nothing. After it went viral, I learned one very simple truth: you need to swing big to win. Cluely is the most ambitious version of Interview Coder , and will redefine the way that humans experience AI. Launching 4/20 at 2PM EST.",4m,1407,54,0,https://www.linkedin.com/in/roy-lee-goat?miniProfileUrn=urn%3Ali%3Afsd_profile%3AACoAAFdZSTQB7UqPnQv0aRN1T6Rg0w2FIav1FYo
"I scaled Interview Coder to $3M in annual recurring revenue in <3 months by going viral—recording myself passing an Amazon interview using the tool and getting kicked out of Columbia for it. Here are my thoughts on growth and marketing as an early-stage consumer startup: My core thesis is that the only thing that works at this stage is ORGANIC VIRALITY. You simply don't have the capital or recognition to get attention any other way. Nobody's watching your podcast, nobody's reading your newsletter, nobody's reading your lameass tweets (yes, YOUR lameass tweets), and you can't afford ads. The only thing that matters is top-of-funnel, so you MUST do something that goes viral. There seem to be only 2 ingredients to this: 1) Viral sense. If you don't have it, it will be hard to go viral. You need to scroll. If you're under 25 and spend a few hours a day online, you probably have it. If you're older or less chronically online, you probably don't. 2) Post quantity. You just need to post enough. If you have viral sense and are posting consistently, you will make it. Everyone says distribution is the last moat, but if you truly internalized this, you'd be posting. A better top-of-funnel is more profitable than the most highly converting, beautiful landing page in the world. In my case, I knew that by recording myself using Interview Coder to pass an Amazon interview and sharing the controversy of getting kicked out of Columbia, the story would spread. I blew up my entire career and education to force this to work and it paid off in a big way. And in all honesty, I don't think there is a universe where this story didn't blow up. At the early stage, especially as a younger founder, you should be more confident in your ability to market virally than in your product being the next Airbnb or Uber. Build with virality in mind, trust your instincts, and TAKE MORE RISKS.",4m,1559,87,0,https://www.linkedin.com/in/roy-lee-goat?miniProfileUrn=urn%3Ali%3Afsd_profile%3AACoAAFdZSTQB7UqPnQv0aRN1T6Rg0w2FIav1FYo
We just shipped the BIGGEST UPDATE to Interview Coder in history. New features: Click-through overlay: No more mouse-off-screen tracking. No other software has this. Problem analysis: Auto-generates clarifying questions + edge case breakdowns. Dry test runs: Code walkthroughs in comments to prove your solution works. It's insane how slow big tech is to move. This software is still unpatched and completely undetectable. Try it for yourself: www.interviewcoder.co hashtag # chatgpt hashtag # ai hashtag # swe hashtag # technicalrecruiting,4m,4790,253,0,https://www.linkedin.com/in/roy-lee-goat?miniProfileUrn=urn%3Ali%3Afsd_profile%3AACoAAFdZSTQB7UqPnQv0aRN1T6Rg0w2FIav1FYo
mom im on fireship!,5m,2324,74,0,https://www.linkedin.com/in/roy-lee-goat?miniProfileUrn=urn%3Ali%3Afsd_profile%3AACoAAFdZSTQB7UqPnQv0aRN1T6Rg0w2FIav1FYo
"I just got kicked out of Columbia for taking a stand against Leetcode interviews. Here’s the whole story: In Fall 2024, I transferred into Columbia as a CS major. I came in knowing I wanted to start a company and immediately found a great co-founder in Neel Shanmugam A few early projects didn’t go anywhere. After a while, we realized something important: We didn’t need a better product. We needed distribution. So we flipped the usual startup model on its head and decided to just build something we knew would go viral first, focusing on distribution before anything. That's how we came up with Interview Coder — an invisible application that helps you pass Leetcode interviews The plan was to use it ourselves, get offers from top companies, film everything, and ride the shock factor. We built the MVP in 10 days and launched it free + open source on LinkedIn. It got a few views, but it didn’t go hyper viral. Still, we had a gut feeling this idea had legs. So we used the whole recruiting season to polish it. Eventually, I got offers from Meta, TikTok, and Capital One. We launched on LinkedIn again, this time with actual results — and the response was bigger. I went too far when I posted all the offers as job experience. That got my old account banned from LinkedIn— and from many subreddits we were relying on for growth. But by that point, I had what I needed. We recorded the entire Amazon process — every step of me using InterviewCoder from OA to final offer. The UX was clean. The results were real. I posted the video. It started to blow up. Then Columbia sent me a disciplinary notice. Apparently, an Amazon executive had sent the school a letter saying something to the effect of: “Expel this kid or we won’t hire from your school again.” I was told not to share the letter, but at that point, I had two choices: → Stay quiet and get buried (Columbia would surely have sided with Amazon to kick me out) → Or go public and fight I leaked the letter, and it went super viral on X. That single moment probably protected me more than anything else. At the hearing, Columbia forced me into a weird admission that the tool could be used to help students cheat in a Columbia CS class. (It can’t.) and put me on academic probation, scheduling another hearing for leaking all the documents. A week and a half later, and I'm completely kicked out from school. LOL! It's funny now and an amazing story in hindsight, but the truth is I was tweaking bad throughout this entire process. Taking this much risk tested my mental strength to its absolute limit, but I'm super glad I did it. Interview Coder still works, and we just pushed the biggest update to it ever for maximal undetectability. More soon.",5m,67092,3,0,https://www.linkedin.com/in/roy-lee-goat?miniProfileUrn=urn%3Ali%3Afsd_profile%3AACoAAFdZSTQB7UqPnQv0aRN1T6Rg0w2FIav1FYo
"Eliam got the ball rolling on a lot of stuff for me and Neel. Big dreams start with a first believer. If you’re working on side projects and have even the tiniest bit of delusion/fear that consulting or IB might not be the future for you, I’d highly recommend talking to Eliam. Interview Coder started out as a fun side project and Eliam was one of the first people to pounce on it (and us) and encourage us to take it somewhere. The smallest ideas can lead to the biggest companies. Would recommend a conversation if you’re at Columbia and tinkering.",5m,128,4,0,https://www.linkedin.com/in/roy-lee-goat?miniProfileUrn=urn%3Ali%3Afsd_profile%3AACoAAFdZSTQB7UqPnQv0aRN1T6Rg0w2FIav1FYo
"Absolutely thrilled to share that my summer internship offers from Meta , Amazon , and Capital One have been rescinded! To do what I did (minus getting rescinded), head over to www.interviewcoder.co . hashtag # swe hashtag # summerinternship hashtag # rejection hashtag # redirection",5m,2067,74,0,https://www.linkedin.com/in/roy-lee-goat?miniProfileUrn=urn%3Ali%3Afsd_profile%3AACoAAFdZSTQB7UqPnQv0aRN1T6Rg0w2FIav1FYo
Locking up 15 of Columbia's best founders in a cabin and forcing them to compete to make money. www.cuhackshack.com 2/28-3/2 Stay tuned.,6m,84,3,0,https://www.linkedin.com/in/roy-lee-goat?miniProfileUrn=urn%3Ali%3Afsd_profile%3AACoAAFdZSTQB7UqPnQv0aRN1T6Rg0w2FIav1FYo
GG,6m,52,3,0,https://www.linkedin.com/in/roy-lee-goat?miniProfileUrn=urn%3Ali%3Afsd_profile%3AACoAAFdZSTQB7UqPnQv0aRN1T6Rg0w2FIav1FYo
I used to have a Youtube account where I posted tutorial videos of how to do Leetcode questions literally called MrLeeCode LOLOLOL. It's hilarious how much of my life I wasted on this. Now I'm going to post tutorials on how to pass big tech interviews in your sleep! www.interviewcoder.co hashtag # ChatGPT hashtag # TechnicalInterviews hashtag # Recruiting hashtag # SoftwareEngineering hashtag # SWE hashtag # Leetcode,6m,71,4,0,https://www.linkedin.com/in/roy-lee-goat?miniProfileUrn=urn%3Ali%3Afsd_profile%3AACoAAFdZSTQB7UqPnQv0aRN1T6Rg0w2FIav1FYo
Why does everyone think my offers are fake? You can do it extremely easily as well! Crack Big Tech interviews in your sleep: www.interviewcoder.co,6m,79,1,0,https://www.linkedin.com/in/roy-lee-goat?miniProfileUrn=urn%3Ali%3Afsd_profile%3AACoAAFdZSTQB7UqPnQv0aRN1T6Rg0w2FIav1FYo
Here's full footage of how I used an AI took to ace my final round technical interview with Amazon! Help me take down Leetcode: www.interviewcoder.co hashtag # chatgpt hashtag # technicalinterviews hashtag # recruiting hashtag # swe,6m,44,7,0,https://www.linkedin.com/in/roy-lee-goat?miniProfileUrn=urn%3Ali%3Afsd_profile%3AACoAAFdZSTQB7UqPnQv0aRN1T6Rg0w2FIav1FYo
